title,
Ukraine: Angry Zelensky vows to punish Russian atrocities,
War in Ukraine: Taking cover in a town under attack,
Ukraine war 'catastrophic for global food',
Manchester Arena bombing: Saffie Roussos's parents on hearing the truth,
Ukraine conflict: Oil price soars to highest level since 2008,
Ukraine war: PM to hold talks with world leaders on further sanctions,
Ukraine war: UK grants 50 Ukrainian refugee visas so far,
TikTok limits services as Netflix pulls out of Russia,
"Covid: Fourth jab for Scotland's vulnerable, and testing wind down fears in Wales",
Protests across Russia see thousands detained,
Ukraine conflict: Your guide to understanding day 11,
Russian gymnast investigated for wearing pro-war symbol on podium next to Ukrainian,
"Ukraine: With placards and tears, Poles are greeting refugees like family",
Twitter is part of our war effort - Ukraine minister,
Ukraine invasion: Volunteers 'working on autopilot',
Ukraine crisis: The West fights back against Putin the disruptor,
"Mariupol: Fires, no water, and bodies in the street",
The young Ukrainians battling pro-Russian trolls,
Ukraine maps: New agreed ceasefire breaks down in south,
Five ways the Ukraine war could push up prices,
Ukraine: 'We try to tell them the truth' - parenting in wartime,
War in Ukraine: Russian helicopter shot down by missile,
European peace seems as fragile as ever,
"War in Ukraine: Russians on boycotts, sanctions and cancellations",
"Ukraine war: 'My city's being shelled, but mum won’t believe me'",
Nuclear plant: How close was nuclear plant attack to catastrophe?,
Ukraine war: Why Kherson and Mariupol are key to Russian success,
The Papers: 'Running for their lives' as terror 'rains down',
Ukraine invasion: Military couple marry on the frontline,
Ukraine invasion: The children with cancer fleeing war at home,
'They thought he was too young for heart disease',
Zeebrugge: 'You had to cling on for your dear life',
Belfast: The sounds of the city during Covid lockdowns,
Mandibuloacral dysplasia: 'You feel guilty not wanting her to get older',
Man in dinghy in near miss with Southampton-bound container ship,
Why doesn't Ukraine attack the Russian convoy? And other questions,
The sophisticated tech predicting if an advert will work,
Roman fort survey near Melrose aims to unveil more secrets,
Russia oligarchs: The mega-rich men facing global sanctions,
"From Grozny to Aleppo to Ukraine, Russia meets resistance with more firepower",
Jane Campion: Power of the Dog director thrilled with her Hollywood comeback,
BBC Ukrainian editor: 'My mother called to say she'd managed to buy bread',
War in Ukraine: Russian invasion fuels Finnish support for Nato,
Identity: What does it mean to be Welsh?,
Why Indian fathers are embracing paternity leave,
'Either they're not good enough or they don't care' - pundits react to Man Utd's derby display,
England bowler Robinson ruled out of first Test with back injury,
Who's got his club buzzing again? - Garth's Team of the Week,
Welsh Open: Joe Perry beats Judd Trump to win title,
GB ski pairings win two more Paralympic bronzes,
'Man City prove a point to anyone who doubted them' - MOTD2 analysis,
Covid-19 in the UK: How many coronavirus cases are there in my area?,
What are the UK's 'Living with Covid' plans?,
Covid: Five things we still need to keep an eye on,
Covid boosters: Who will get a fourth dose?,
What are the latest rules for face coverings and masks?,
Covid: How to look after yourself at home,
"Covid map: Coronavirus cases, deaths, vaccinations by country",
What are the self-isolation rules in England and the rest of the UK?,
When will free Covid tests end in England?,
What Covid tests do I still need to travel abroad?,
How will the vulnerable be protected from Covid? And other questions,
Ukraine conflict: Oil price soars to highest level since 2008,
One dead after Scottish trawler capsizes off Norway,
Ukraine: Irish medical student 'blocking out dangers' in Sumy,
Northumberland shooting star caught on one-in-million photo,
One dead after Scottish trawler capsizes off Norway,
Ukraine invasion: Military couple marry on the front line,
Ukraine conflict: Oil and gas prices soar as shares plunge,
Ukraine war: PM to hold talks with world leaders on further sanctions,
One dead after Scottish trawler capsizes off Norway,
Shane Warne: Australian cricket legend died from natural causes - police,
'Phil Foden sets the tempo' - how Man City 'steamrollered' Man Utd,
Women's World Cup: Bates stars as New Zealand thrash Bangladesh,
Ukraine conflict: Shares slide as oil and gas prices soar,
Ukraine war: PM to hold talks with world leaders on further sanctions,
One dead after Scottish trawler capsizes off Norway,
Shane Warne: Australian cricket legend died from natural causes - police,
Russian gymnast Ivan Kuliak investigated for wearing pro-war symbol on podium next to Ukrainian,
A small Ukrainian city becomes a waypoint for thousands on the move,
How many refugees have fled Ukraine and where are they going?,
Ukraine: Irish medical student 'blocking out dangers' in Sumy,
Ukraine: India doctor stranded with a jaguar and panther,
WSL highlights: Arsenal survive scare to beat Birmingham and extend WSL lead,
Blue and yellow flowers as Queen meets Trudeau,
Ukraine conflict: Petrol at fresh record as oil and gas prices soar,
Lynda Baron: Open All Hours actress dies aged 82,
Ed Sheeran denies Shape of You copyright claim at High Court trial,
Dizzee Rascal: Grime artist guilty of assaulting former partner,
Ukraine war: PM holds talks with Canadian and Dutch PMs over more sanctions,
One dead after trawler which sailed from Peterhead capsizes off Norway,
Baby killed in suspected dog attack at Ostler's Plantation,
Scans reveal how Covid may change the brain,
Corrie Mckeague would binge-drink after friend's death - inquest,
Chaos and tears as thousands try to catch a train out of Ukraine,
"Ukraine maps: Ukraine says Russian ceasefire offer ""immoral""",
How many refugees have fled Ukraine and where are they going?,
Five ways the Ukraine war could push up prices,
Ukraine: Irish student makes fresh escape attempt,
Economic Crime Bill: What is it and will it find Putin's loot?,
Doctors call on Wales not to pick Francis following head injury against England,
Henderson back in Ireland squad to face England but Larmour out for rest of Six Nations,
"Six Nations 2022: Gray, Hastings, Young & Thompson added to Scotland squad",
"'If you have it, flaunt it' - West Indies icon Richards at 70 talks cricket style, friendship with Lord Botham and standing up to racism",
Russian gymnast investigated for wearing pro-war symbol,
"Warne died from natural causes, Thai police say",
"War in Ukraine: 'It's hell, it's really hell' - Families flee bombs in Irpin",
Ukraine: Volodymyr Zelensky to address UK MPs in Commons,
Blue and yellow flowers as Queen meets Trudeau,
Ukraine conflict: Petrol at fresh record as oil and gas prices soar,
Lynda Baron: Open All Hours and Come Outside actress dies aged 82,
Ukraine war: Boris Johnson defends refugee response after visa criticism,
Dizzee Rascal: Grime artist guilty of assaulting former partner,
Ed Sheeran denies Shape of You copyright claim at High Court trial,
McDonald's and Coca-Cola boycott calls grow over Russia,
Ukraine war: PM calls for 'step-by-step' move from Russian fuel,
"Iowa tornadoes: Seven people killed, including two children",
Ukraine conflict: Your guide to understanding day 12,
Why has 'Z' become a Russian pro-war symbol?,
Ukraine war: Chernobyl workers' 12-day ordeal under Russian guard,
Ukrainians on way to UK hit paperwork dead-end in Calais,
How many refugees have fled Ukraine and where are they going?,
Family separated by war in Ukraine finally reunited,
Servant of the People: 'Zelensky's comedy made me admire him more',
Ukraine: Irish student makes fresh escape attempt,
"Mercedes bullying led to Masi's removal as F1 race director, says Red Bull's Horner",
Man Utd players want manager clarity amid uncertainty,
Lynagh withdraws from England squad after positive Covid-19 test,
Covid-19 in the UK: How many coronavirus cases are there in my area?,
War in Ukraine: Russia says it may cut gas supplies if oil ban goes ahead,
Ukraine: Volodymyr Zelensky to address UK MPs in Commons,
"Ukraine war: 300 Ukrainians get visas via new scheme, says UK",
Cost of living: Warning UK faces biggest income squeeze in nearly 50 years,
Government rescue of Bulb Energy set to cost taxpayers billions more,
"Amazon rainforest reaching tipping point, researchers say",
War in Ukraine: Crisis is unleashing 'hell on earth' for food prices,
Public sexual harassment: PM urged to ‘step up’ on women’s safety,
"Covid vaccines not linked to deaths, major US study finds",
War in Ukraine: Five times Russians have stood up for Ukraine,
War in Ukraine: World Bank approves $723m financial package,
McDonald's and Coca-Cola boycott calls grow over Russia,
"Chaos, upheaval and exhaustion for Ukraine's disabled children",
Ukraine invasion: False claims the war is a hoax go viral,
The Papers: Putin's 'cynical' refugee offer and UK urged to help,
War in Ukraine: Live-streaming music from a Kharkiv basement,
Vera Wang: I find ageism so old-fashioned,
"Turning Red: Killing Eve's Sandra Oh on celebrating Pixar, puberty and periods",
Ukraine: Documenting the war on TikTok,
Ukraine: Irish student makes fresh escape attempt,
Femicide detectives: 'Counting bodies is the best place to start',
Why misogyny is at the heart of South Korea's presidential elections,
I've cut out energy drinks now mum's given me a kidney,
Can tech help revive India's 'crumbling' health system?,
Ukraine: Small and big ways in which people in the UK are helping out,
Scotland's World Cup play-off against Ukraine postponed,
Angel City FC: Eni Aluko on working for the Los Angeles franchise,
Zverev given suspended eight-week ban for striking umpire's chair,
'I'm very energised to take this team forward' - Root feels he is still right man to lead England,
International Women's Day: How Chelsea 'changed the game' in women's football,
War in Ukraine: Russia says it may cut gas supplies if oil ban goes ahead,
Ukraine war: UK can and will do more for refugees - minister,
"Covid: Vaccines not linked to deaths, says study, and brain changes after virus",
Shane Warne: Do liquid diets work and are they safe?,
"Fury's future plans, AJ's new coach and Khan's rematch ambition - Fight Talk",
Healy helps Australia beat Pakistan at World Cup,
War in Ukraine: West hits Russia with oil bans and gas curbs,
War in Ukraine: Troops dig in near Kyiv,
Ros Atkins on… The UK’s refugee response,
"War in Ukraine: McDonald’s, Coca-Cola and Starbucks halt Russian sales",
War in Ukraine: Warning oil sanctions will further hit UK living costs,
Ukraine: Volodymyr Zelensky invokes Winston Churchill as he appeals to MPs,
Ukraine: Ministers can now detain Russian planes in UK,
Ukrainian actor Pasha Lee killed in Russian bombardment,
Almost two million pupils regularly missing school,
Stool tests might help spot early pancreatic cancer,
Online Safety Bill tweaked to target scam ads,
Prince Andrew pays settlement ending sex assault case,
Vamps star tells of liposuction body-image pressure,
'We are not co-operating': Life in occupied Ukraine,
Ukraine war: How reliant is the world on Russia for oil and gas?,
Ukraine: Family escapes Kharkiv to Poland to treat daughter's cancer,
Ukraine: Are arms shipments from the West making a difference?,
Ukraine: Mother of Russian soldier asks 'Whose door should I knock on to get my child back?',
Clive Myrie: The Ukrainians I met are not about to give up,
The Papers: Zelensky channels Churchill and US-UK oil ban,
In full: Ukrainian President Zelensky's message to UK,
Zelensky's moments: From TV star to wartime leader,
CEO Secrets: Drone boss Henri Seydoux shares his advice,
Ukraine: Frozen stars send messages of support to girl singing Let It Go,
Ukraine: Travel curfew halts Irish student's escape attempt,
Ukraine: Trauma surgeon teaches medics over Zoom,
War in Ukraine: President Zelensky posts video from office in Kyiv,
Ukraine: Does the Home Office need to get a grip?,
Private military firms see demand in Ukraine war,
Russia-Ukraine: Is internet on verge of break-up?,
Ukraine crisis: Is the UK doing enough to help refugees?,
Zimbabwe clinics struggle for nurses after exodus to the UK,
What is going on with the partygate probe?,
Sloppy England shocked by Windies at World Cup,
"Liverpool deserve quarter-final spot despite 'slapstick' finishing in loss to Inter, says Klopp",
Bairstow ton rescues England against West Indies,
Lewandowski scores earliest Champions League hat-trick as Bayern hit seven,
Andy Murray pledges to donate prize money to help children in Ukraine,
World Cup 2022: Wales' play-off with Austria to go ahead in March,
Women's World Cup: Deandra Dottin takes sensational catch against England to dismiss Winfield-Hill,
Russia could launch chemical attack in Ukraine - White House,
Ukraine ambassador calls for UK to end 'bureaucratic red tape' for refugees,
War in Ukraine: Oil prices plunge as UAE supports supply boost,
"Ukraine-Russia war: The era of complacency is over, says Liz Truss",
Ukraine: Private militias recruiting former soldiers,
IMF approves $1.4bn emergency funds for Ukraine,
"Use Russian money to rebuild Ukraine, says bank chief",
"Chancellor faces tough calls over households' income hit, says IFS",
Faulty drainage work blamed for fatal Stonehaven derailment,
Toddler tossed to safety from burning building,
US Border Patrol finds dozens of snakes and reptiles in man's outfit,
Djokovic pulls out of US events over Covid rules,
Real Madrid 3-1 Paris St-Germain (3-2 agg): Karim Benzema hat-trick inspires superb Real fightback,
The Russians using emojis to evade censors,
Ukraine war: Children of the Soviet era running from Russia,
Ros Atkins on... food price rises and the Ukraine war,
Ukraine war: UK Home Office is in crisis mode over visas,
Ukraine conflict: Your guide to understanding day 14,
The Papers: 'Barbaric' children's hospital bombing 'a new low',
Dolly Parton partners with James Patterson for first novel,
Encanto director invites glasses 'hero' schoolgirl Lowri to Baftas,
Endurance: Underwater robots find Shackleton's lost ship,
Halifax Acapulco club sells off sticky carpet,
The Capitol riot trial that tore a family apart,
Fact-checking PM's claim about refugees,
Israel's Bennett plays peacemaker in Ukraine-Russia war,
Winter Paralympics: 'I chose to have my leg amputated after years of pain',
Drought robs Amazon communities of 'life-giving' river,
Kidney donor: I call my remaining one Home Alone Kevin,
The Marvellous Neil Baldwin is back to make us feel better,
England in West Indies: Tourists bowlers blunted on attritional second day in Antigua,
'It's a team award' - Woods gives emotional speech in Hall of Fame induction,
Women share stories of running in public and their safety concerns,
Mazepin & father added to list of wealthy Russians sanctioned by EU,
Man City comfortably into Champions League last eight with draw,
"'A crazy experience' - Liverpool's Harvey Elliott on injury, recovery and Champions League history",
On the front line of the battle for Kharkiv,
Ukraine war: Large Russian convoy redeploys near Kyiv - satellite images,
Ukraine war: People can welcome refugees into own homes - PM,
Ukraine conflict: Growing numbers of firms pull back from Russia,
Twitter blocks Russian claims on hospital attack,
War in Ukraine: Facebook to allow calls for violence against Putin,
Jussie Smollett sentenced to 150 days in jail in attack hoax case,
"N Korea tested long-range missiles, says US",
Ukraine war: Roman Abramovich sanctioned by UK,
Fans chant Abramovich's name at Chelsea win,
Covid deaths probably three times higher than records say,
UK Covid inquiry draft terms of reference set out,
"Covid pandemic fuels deepening education inequalities in England, say MPs",
"Watch: Our correspondent on the front line, with Ukraine’s troops",
Ukraine war: Images reveal scale of destruction in Mariupol,
"Ukraine war: 'I have 20 children here, please send help'",
"What is a war crime, and could Putin be prosecuted over Ukraine?",
War in Ukraine: A family's 'torturous' UK visa chase,
Ukraine: What sanctions are being imposed on Russia?,
Ukraine: What happened on day 15 of Russia's invasion,
Ukraine war: Column of Russian tanks ambushed by Ukrainian forces,
WATCH: Disposal experts defuse unexploded bomb in Ukraine,
Roman Abramovich: What do Russian owner's sanctions mean for Chelsea?,
What is a thermobaric or vacuum bomb?,
The Papers: 'Roman empire falls' and 'hotline to host refugees',
Quiz of the week: Who helped Dolly write a novel?,
'I just don't think we're being listened to',
Russia-Ukraine war: Foreign fighters go to join defence,
Ukraine war: Indian students on the trauma of escaping,
UK boy donates teddy bear to Ukrainian child,
Classic Queen cover art for A Day at the Races sells for £28k,
Gracie Spinks: Receipt could have traced killer - family,
Climate change: Can the Russian energy crisis help to curb global heating?,
Does your boss really care what you think?,
Timbuktu manuscripts: Mali's ancient documents captured online,
Ukraine war: How reliant is the world on Russia for oil and gas?,
"'As long as we have enough shirts and a bus, we'll be there' - Chelsea bosses vow to carry on",
England toil as Bonner hits century to put West Indies on top,
Commanding Rangers take big step towards Europa League quarter-finals,
Formula 1 testing: Red Bull unhappy with Mercedes upgrade in Bahrain,
Chelsea: Thomas Tuchel has faith in those in charge of club's future,
Chelsea thrash West Ham at end of 'difficult day' for club,
Ukraine war: Kyiv prepares for Russian attack,
"Battle for Mykolaiv: 'We are winning this fight, but not this war'",
Ukraine war: Ukrainians mourn their fallen soldiers,
Roman Abramovich: Chelsea have credit card facilities temporarily suspended,
The race is on for affordable energy for the UK's homes and businesses,
Fears funeral plan reforms could mean thousands lose money,
Disney apologises for 'silence' on 'Don't Say Gay' bill,
Transgender children: Texas plan to probe parents halted,
France keep Six Nations Grand Slam dream alive,
England in West Indies: Zak Crawley hits hundred as tourists dominate day four in Antigua,
Queen pulls out of attending Commonwealth Service,
UK sanctions 386 Russian MPs over Ukraine invasion,
Covid infections rising again across UK - ONS,
"Under threat of Russian bombs, Lviv hides away its priceless heritage",
War in Ukraine: How Russia is recruiting mercenaries,
Ukraine war: Fact-checking Russia's biological weapons claims,
Ukraine: Spam website set up to reach millions of Russians,
What sanctions are being imposed on Russia over Ukraine invasion?,
Mariupol hospital attack: Pregnant woman hurt in bombing gives birth,
Ukraine: What happened on day 16 of Russia's invasion,
Ukraine: Thousands of vulnerable children unaccounted for,
Will Nato get involved if dirty bombs are used in Ukraine? And other questions,
Watch: Our correspondent goes into no-man's land with the Ukrainian army,
Which companies are pulling out of Russia?,
Roman Abramovich: What do Russian owner's sanctions mean for Chelsea?,
The Papers: Kyiv faces siege and UK under fire over refugees,
Intimate image abuse: His confession protected him,
Building a bigger home for the British Library collection,
The friends who explore abandoned buildings,
Week in pictures: 5-11 March 2022,
'Young people may have 10-plus careers in their lifetime',
British Pie Awards: Gluten-free pie crowned winner,
Mystery drone from Ukraine war crashes in Croatia,
Mark Kermode and Simon Mayo are ending their 5 Live film show,
Jussie Smollett: A complete timeline from actor's 2019 arrest to jail time,
Honduran authorities burn eight tonnes of cocaine,
UK visas for Ukrainian refugees: 'We don't deserve such an attitude',
Pregnancy loss: 'I just don't think we're being listened to',
Martin Compston: From a school corridor to stardom,
'Reselling PlayStations keeps a roof over my head',
Farming Wales: The farmer making vodka from sheep milk,
Australia floods: 'I'm angry it's happening again',
Ukraine: How China is censoring online discussion of the war,
The Ukrainian sisters separated by war,
Covid-19 in the UK: How many coronavirus cases are there in my area?,
‘It was a nightmare in that place’,
Cost of living: What Tory MPs want from Rishi Sunak,
Raducanu into Indian Wells third round with win over Garcia,
Murray beats Daniel at Indian Wells for 700th ATP win,
Winter Paralympics: Britain's Menna Fitzpatrick finishes fourth in slalom,
Six Nations: 'Ireland will demand new level from new England',
Six Nations: France edge past Wales to keep Grand Slam hopes alive,
Women's World Cup: 'Sensational!' - Matthews takes brilliant catch to remove Sharma,
Six Nations: Dan Biggar kept Wales in the game against France - Martin Johnson,
Ukraine war: Evacuations 'extremely difficult' amid shelling,
Ukraine war: UK households offered £350 a month for hosting refugees,
Roman Abramovich: Rabbi investigated over Portuguese citizenship,
Sarah Everard: Protesters demand 'radical change' to Met Police,
Scotland and Wales bid to be refugee super sponsors,
Brexit: Micheál Martin and Boris Johnson discuss NI Protocol,
England in West Indies: Spirited tourists have to settle for draw in first Test,
Ukraine war: Protests after Russians 'abduct' Melitopol mayor,
Boss accused of defrauding blind workers' pensions,
Saudi Arabia executes 81 men in one day,
Body of missing hillwalker found in Glen Coe,
Rod Stewart fixes potholes near his Harlow home,
Manchester United 3-2 Tottenham Hotspur: Cristiano Ronaldo scores hat-trick in thriller,
War in Ukraine: 'No one wants to die' - meeting Ukraine's teenage soldiers,
Russia faces brain drain as thousands flee abroad,
Russia sanctions: How the measures have changed daily life,
Ukraine maps: At-a-glance guide to the Russia war,
Ukraine: 'Not all Russians support this war',
The Papers: £350 a month refugee plan and plea to help orphans,
Your pictures on the theme of 'urban landscape',
The first sex worker strike: 'We are just women and mothers',
Ukraine war: Pictures of war intensifying in third week,
Console 'scalper' on stockpiling PlayStations for profit,
Will Russia's attack on Ukraine help thaw US-Venezuela relations?,
Indian evacuee: The kindness of Ukrainians saved my life,
Xenotransplantation: Are pigs the future of organ transplants?,
Bafta Awards 2022: Stars prepare to return to in-person ceremony,
"'Without TikTok, I'd still be a wedding singer'",
PGI status: Could Welsh leeks become the new Cornish pasty?,
Isak Munda: The Orissa labourer who became a YouTube star,
Ronaldo says there 'are no limits for Man Utd' - but has his hat-trick broken a world record?,
Michael Conlan reveals he is OK after Leigh Wood retains world title with brutal knockout,
"West Indies draw a huge step forward, says England captain Root",
How England's 14 men whipped up Twickenham crowd with stirring display,
'Salah must decide if he wants icon status - or money' - will Liverpool forward stay at Anfield?,
MOTD analysis: How 'sensational' Cristiano Ronaldo dominated Tottenham Hotspur,
Six Nations highlights: Ireland beat England to keep alive Six Nations hopes,
Ukraine crisis: US warns China against helping Russia,
Ukraine war: 21 children flown to UK for cancer treatment,
Bafta Film Awards: Benedict Cumberbatch's The Power of the Dog wins top prize,
William Hurt: Oscar-winning actor and Marvel star dies at 71,
Tom Brady: NFL great makes retirement U-turn after just six weeks,
Ukraine war: UK refugee scheme set to launch,
Brent Renaud: US journalist and filmmaker killed in Ukraine,
Hong Kong: Briton accused of jeopardising China's security,
"No-one raised security concerns over Lord Lebedev with me, says Michael Gove",
Irbil attack: Iran launches missiles at northern Iraqi city,
Chelsea 1-0 Newcastle United: Kai Havertz's late goal gives hosts three points,
Unions warn of job losses if rail firms close ticket offices,
Rod Stewart: Videos prompts pothole DIY repair warning,
Zhytomyr: Aerial attacks hit city that is corridor to Kyiv,
Ukraine war: Zelensky visits wounded Ukrainian soldiers,
How to spot false posts from Ukraine,
Ukraine war: Five times refugees were met with kindness,
Poland feels the strain of Ukraine's refugees,
War in Ukraine: What happened on day 18 of Russia's invasion,
Why I want to share my home with a Ukrainian refugee,
War in Ukraine: Uni to uniform - Ukraine's new teenage army recruits,
Newspaper headlines: 'War at Nato's door' as Putin has 'West in sights',
Baftas 2022: Seven highlights - from the jokes to the dresses,
The Syrian women replacing men as leaders,
Brent Renaud: Friend of US journalist killed in Ukraine speaks to BBC,
Northumberland farm welcomes five-legged lamb,
Reproductive coercion: 'I wasn't allowed to take my pill',
British food: How traditional firms are faring under pressure,
'I thought I had Covid but it was terminal lung cancer',
The innovative surfing tech making waves,
Deep listening: I realised we all share the same human feelings,
Rosacea: 'Your skin doesn't define you',
The Muslim women learning to ride a bike in their 40s,
'No doubt I'll stay until end of season' - Tuchel pledges future as Chelsea taking things 'day by day',
'So emotional for me' - Ukraine's Yarmolenko scores as West Ham beat Aston Villa,
