title,
Sergiy Stakhovsky: Ukrainian tennis player who returned to defend his country,
Ukraine war: Snake Island and battle for control in Black Sea,
"Ukraine war: Don’t underestimate Russia cyber-threat, warns US",
Ukraine war: Security pacts and Eurovision joy - Wednesday's round up,
Kherson: How is Russia imposing its rule in occupied Ukraine?,
"Boris Johnson orders cuts to around 90,000 civil service jobs",
"Deborah James, host of Big C podcast, honoured with damehood",
"Ukraine war: Keep sanctions until Russian troops leave, says Liz Truss",
North Korea announces first death from Covid-19,
"UK’s nuclear power push may add to energy bills, minister says",
Platinum Jubilee: Lemon and amaretti trifle to be official pudding,
Two Twitter bosses ousted ahead of Elon Musk $44bn takeover,
Couple in India sue son for not giving them a grandchild,
US Army identifies paratrooper killed in Alaska bear attack,
"Offer women oral tablet to treat fibroids, NHS advised",
Queensland floods: Residents evacuate as Australia faces new emergency,
Thousands sign up to count plastic waste for a week,
Eurovision 2022: Ireland's Brooke fails to qualify for the final,
The Papers: UK to 'rip up' border deal and 'Dame Debs' honoured,
Quiz of the week: Why was Oscar nominee glued to a Starbucks?,
Eurovision 2022: The anthem for Ukraine born in a war zone,
The Ukrainian refugee schoolgirl learning fast in the UK,
US surpasses one million deaths to Covid-19,
What is conversion therapy and when will it be banned?,
Extreme weather: What is it and how is it connected to climate change?,
Eurovision 2022: Sam Ryder is 'ignoring the hype' as the UK's odds improve,
Afghanistan pupils in fear after spate of Islamic State attacks,
Why the 'shocking' price of aluminium matters,
Author Benjamin Myers on the crop-circle makers who 'blew people's minds',
Tottenham 3-0 Arsenal: Spurs increase top-four pressure on Gunners with victory,
Tottenham 3-0 Arsenal: Harry Kane and Son Heung-min score as Spurs close in on top four,
"Transfer rumours: Calvert-Lewin, Pogba, Lewandowski, Sterling, Guardiola, Rice",
Sebastian Vettel says climate makes him question whether racing in F1 is right thing to do,
Ukraine conflict: Russian soldiers seen shooting dead unarmed civilians,
Ukraine crisis: Could India cut its defence ties with Russia?,
How can I offer a UK home to Ukrainian refugees?,
"Ukraine war: Threat to Finland over Nato, and Russians shoot civilians - round-up",
Deborah James made a dame by William at her home,
Junk food: Ministers to delay ban on multi-buy deals,
NI Election 2022: Prime minister to visit NI as DUP blocks assembly,
"Eurovision final 2022: Wolves, treadmills and high hopes for the UK",
Coleen Rooney: My online post was a last resort,
Richard Mylan: Waterloo Road star reveals heroin addiction battle,
History or revenge - what's at stake in FA Cup final?,
Shireen Abu Aqla: Violence at Al Jazeera reporter's funeral in Jerusalem,
Defending champion Phil Mickelson withdraws from PGA Championship,
Two women arrested over Stockport nursery baby death,
Nazanin Zaghari-Ratcliffe tells PM: Your mistake had a lasting impact,
Archie Battersbee: Judge backs brain-stem test to determine if boy is dead,
Mao Zedong scroll thieves jailed in Hong Kong,
The Papers: 'Dame in a day' and 'Coleen's split',
Eurovision: Rylan Clark's top tips for final,
Ros Atkins on… The Northern Ireland Protocol,
Gentleman Jack: Romsey student is modern-day 'replica' of 19th Century lesbian,
Week in pictures: 7-13 May 2022,
Photos of 1900s Herefordshire life discovered hidden in cupboard,
"Falling from train platforms: 'It was terrifying, the guide dog was screaming'",
East Africa drought: 'The suffering here has no equal',
Are we failing young people with cancer?,
Asteroid mining: Helping to meet Earth's natural resource demands,
Northern Ireland Protocol: What did Boris Johnson say?,
Where are the new classic sitcoms?,
Why an Indian couple is suing son over grandchildren,
Bellator London: Logan Storley dominates Michael 'Venom' Page to claim interim welterweight title in London,
Luton Town 1-1 Huddersfield Town: Championship play-off semi-final first leg ends in draw,
Ji So-yun: 'Chelsea star will leave stamp on everybody's heart',
Dina Asher-Smith beaten by Gabby Thomas in Diamond League opener,
Bellator 281: Nottingham's Paul 'Semtex' Daley knocks out Wendell Giacomo with a fierce right hook,
Diamond League: Dina Asher-Smith third on return since injury at Tokyo Olympics,
Ukraine: The spy war within the war,
Ukraine war in maps: Tracking the Russian invasion,
Ukraine conflict: What is Nato and how could Finland and Sweden join?,
Ukraine conflict: Russian soldiers seen killing unarmed civilians,
Ukraine war round-up: Carnage at the river and a war crimes trial,
Eurovision: Where has the UK gone wrong in the past?,
Eurovision commentators reveal their memorable moments - including a presidential petition,
"Eurovision 2022: Ukraine wins, while the UK's Sam Ryder comes second",
Eurovision win brings 'incredible happiness' to Ukraine,
Brexit trade deal change must result in NI government - PM,
Buffalo shooting: Ten dead in attack at supermarket in New York state,
Full lunar eclipse to bring super blood Moon,
Britney Spears announces 'devastating' miscarriage,
Liverpool beat Chelsea on penalties to win FA Cup and keep quadruple hopes alive,
"Junk food: Obesity strategy falling apart, Jamie Oliver says",
"North Korea: Covid outbreak a great disaster, says Kim Jong-un",
Andrew Symonds: Former Australia cricketer dies aged 46 in car crash,
Ukraine war: Putin warns Finland joining Nato would be 'mistake',
Dame Deborah James says Prince William's visit will be a 'special memory',
Chelsea: Woman and three dogs die after being hit by car,
The Papers: 'Anger as fans boo William' and 'Rishi ready to help',
Eurovision 2022: Highlights of Ukraine's winning night,
Song contest in pictures,
FA Cup final: Liverpool boss Jurgen Klopp says he 'could not be more proud' after beating Chelsea,
"World War Two, the Belfast mountain and a white rock",
Bristol mum writes heart surgery book to help son,
Fleeing Syria 10 years on: 'We cried all the way to Jordan',
Eurovision 2022: How Sam Ryder turned things around for the UK,
Afghanistan face veil decree: 'It feels like being a woman is a crime',
Covid: What will the pandemic look like in North Korea?,
"'I searched for my sister for 30 years, but Covid took her from me'",
Joe Wicks: 'I realised my childhood wasn't normal',
Covid: Have the lockdown success stories lost their shine?,
Vitamin D: Could UV-mushrooms help fix the nation’s issue?,
Liverpool win FA Cup: How Jurgen Klopp sets the tone for everything Reds do - Alan Shearer,
FA Cup final: Liverpool beat Chelsea on penalties - highlights,
Chelsea Women v Manchester City Women: Gareth Taylor's side 'desperate' to beat holders,
Josh Taylor stripped of WBA super-lightweight title,
Women's FA Cup final: Everything you need to know as Chelsea play Manchester City at Wembley,
FA Cup final: Konstantinos Tsimikas scores winning penalty for Liverpool against Chelsea,
Ukraine conflict: Russian chemical attack claim fact-checked,
How many Ukrainians have fled their homes and where have they gone?,
Northern Ireland: PM poised for protocol change ahead of crisis talks,
Ukraine: The children's camp that became an execution ground,
Queen attends Platinum Jubilee equestrian extravaganza,
Buffalo shooting: Gunman deliberately sought black victims - mayor,
"Boy, three, dies after suspected dog attack - police",
GCSE and A-level exam invigilator shortages mean parents and teachers are stepping in,
Doctor Who: David Tennant and Catherine Tate to return,
Sexual violence: 100 festivals commit to tackling the issue,
"Ukraine war: Russia's invasion not going to plan, Nato says",
"EasyJet offers £1,000 bonus as airlines battle to recruit staff",
Eurovision and FA Cup final attract bumper audience for BBC,
Kenton Cool reaches record-breaking 16th Everest summit,
The Papers: 'Radiant Queen' and 'PM's gamble risks trade war',
Queen attends Jubilee Royal Windsor Horse Show,
Paralympic swimmer's bid to cross English Channel,
Focus on female farmers in Northumberland and the Scottish Borders,
Eurovision 2022: Sam Ryder and Graham Norton on UK's contest triumph,
The new jet set - why private plane usage has soared,
A tale of two femicides - and media bias,
GCSE and A-level exams 2022: What you need to know,
How Australia became the anxious country,
Why Urdu language draws ire of India’s right-wing,
'I was jumping through hoops to get a loan',
"FA Cup winners Chelsea 'will go down in history', says boss Emma Hayes",
West Ham 2-2 Manchester City: 'Leaders made to wait as Hammers spoil party',
FA Cup final: Chelsea beat Man City 3-2 in Wembley cup final classic,
"Garth Crooks' Team of the Week: Alisson, Dier, Eriksen, De Bruyne, Wissa, Diaz, Kane",
"Transfer rumours: Mbappe, Pogba, Bellingham, Henderson, Ekitike, Neves",
Brentford's Rico Henry and Ivan Toney say their families were racially abused at Everton,
Tottenham: Why Antonio Conte is the key to Spurs keeping Harry Kane - Jermaine Jenas analysis,
Ukraine crisis: Can Africa replace Russian gas supplies to Europe?,
Eurovision win brings 'incredible happiness' to Ukraine,
Mariupol: Hundreds of besieged Ukrainian soldiers evacuated,
Jake Daniels: Blackpool player says coming out will allow him to be 'free' and 'confident',
"Northern Ireland protocol: Legislative solution needed, says PM",
Boris Johnson accepts Northern Ireland impasse down to Brexit deal he signed up to,
Bank governor in 'apocalyptic' warning over rising food prices,
US agrees to ease Trump-era sanctions on Cuba,
Julia James: Callum Wheeler guilty of PCSO murder,
Turkey threatens to block Finland and Sweden Nato bids,
"Johnny Depp hit me on honeymoon, says Amber Heard",
Coleen Rooney says texts between Vardy and agent were evil,
Monkeypox: Four more cases detected in England,
"Help must come, says former PM John Major on cost of living crisis",
Probe after man wrongly diagnosed with Alzheimer's disease,
The Papers: 'Apocalyptic' food cost and footballer's gay pride,
Man with guide dog twice refused access by Tesco,
What do Indigenous people want from Australia's election?,
Harry Styles' new album Harry's House charms music critics,
Open-top bus parade as Stockport seal return to Football League,
Autism football club helped rekindle my Premiership dream,
Ukraine Eurovision win: Presenter hosting from bunker jumps for joy,
Full lunar eclipse creates rare super blood Moon,
The 'village' that got me off drink and drugs,
Anti-abortion groups target women with misleading ads,
US midterm elections- a simple guide,
Jake Daniels: Why Blackpool forward's decision is a watershed moment for British football,
Will swapping out electric car batteries catch on?,
Northern Ireland: Could the EU and UK face a trade war?,
NFHS-5: India's preference for sons over daughters remains,
Julia James murder: How gamekeeper's photo helped catch killer,
Jake Daniels: Gary Lineker says forward will be 'massively accepted' after coming out,
Newcastle 2-0 Arsenal: Gunners' top-four hopes dealt huge blow with loss,
Chelsea takeover: Government ministers fear sale of club to Todd Boehly consortium could 'fall apart',
Jurgen Klopp: Liverpool boss on booing of national anthem at FA Cup final,
Queen's and Eastbourne to keep full ATP ranking points but Wimbledon decision still under review,
"Real Madrid expect Kylian Mbappe decision over transfer within weeks, says Guillem Balague",
Marianna Vyshemirsky: 'My picture was used to spread lies about the war',
What sanctions are being imposed on Russia over Ukraine invasion?,
Pinned down by Russian fire in key frontline village,
Ukraine round-up: Kharkiv shelling eases but Bucha horrors linger,
Ukraine conflict: What is Nato and how can Finland and Sweden join?,
Ukraine war in maps: Tracking the Russian invasion,
Mariupol: Ukraine doing everything to save remaining fighters,
Conservative MP arrested on suspicion of rape,
Half of new nurses and midwives come from abroad,
"Rangers in Seville: Police say 100,000 fans expected",
Amber Heard denies striking Johnny Depp and doctoring photos,
Charles and Camilla visit Canada on royal tour to mark Platinum Jubilee,
Refugee homes branded eyesore by nearby residents,
Scotland falls silent to remember the war dead,
O'Neill attends Remembrance Sunday event for first time,
Former pupil restrained at school wins damages,
"Assisted dying bill has strict safeguards, says MP proposing law change",
Gary Lineker to leave BBC's Match of the Day,
Watch: 'Any good?' Lineker kicks off 25 years as MOTD host,
Bishop calls on Welby to resign over Church abuse scandal,
NHS offers 'improved' stop smoking pill,
Covid inquiry told Treasury blocked NHS bed request,
National park says dropping Snowdon name a success,
ICC announces investigation into chief prosecutor,
Saudi crown prince says Israel committing 'genocide' in Gaza,
Mother-of-two dies during Turkey weight-loss op,
Fujitsu boss 'does not know' if Horizon is reliable,
Match of the Day: Who could replace Gary Lineker as host?,
How Gary Lineker went from football sensation to BBC star,
"Coleen Rooney, GK Barry and Danny Jones in I'm a Celeb 2024 line-up",
An energy efficient home - is it worth the cost?,
New study on moons of Uranus raises chance of life,
Critics say Gladiator II is 'gobsmacking' and 'loopy',
First snow of season for some as Arctic air to sweep in across UK,
Britain's 'best new building of 1996' to be demolished,
Ex-soldier Khalife changes plea and admits prison escape,
Man charged with murder after stabbings at market,
Edinburgh University warns students not to be 'snobs',
"'WhatsApp screen sharing scam lost me £20,000'",
China roads blocked by thousands of cyclists in night quest for dumplings,
Why does it cost £100m for HS2 to protect bats?,
"Trump and Putin, Call Me Maybe?",
Why Trump won (and why Harris lost),
Referee Coote suspended amid Liverpool and Klopp video inquiry,
Gary Lineker to leave BBC's Match of the Day,
Rogers called into England squad as eight pull out,
Review of England's defeat by Australia 'brutal',
Devenny receives first Northern Ireland call-up,
Pickens' amazing catch features in NFL best plays,
England batter Wyatt-Hodge makes Surrey move,
"Driving 'too daunting', says sister of fatal crash victim",
Legal challenge to oil and gas fields begins,
Simpson family to discover police watchdog findings,
Celebrated teacher abused boys over four decades,
Archbishop of Canterbury Justin Welby resigns over Church abuse scandal,
The abuse scandal that led to the archbishop's resignation,
Girl dies on M5 after getting out of police vehicle,
"Oil and gas are a 'gift of god', says COP29 host",
League tables to reveal failing NHS trusts,
"When horror hits China, the first instinct is shut it down",
'I might be dead before a decision is made': Terminally-ill people on assisted dying,
First sighting of Belarusian political prisoner in more than 600 days,
Khalife could have 'endangered Zaghari-Ratcliffe' ,
Post Office jobs and branches at risk in shake-up,
British author Samantha Harvey wins Booker with space story,
Is this the final chapter of the Sue Gray saga?,
"Why Tesla, crypto and prisons are Trump trade winners",
Crowds flock to quiet cul-de-sac after rare bird spotted on washing line,
Immigration cuts: Why prime ministers keep failing to meet their targets,
Match of the Day: Who could replace Gary Lineker as host?,
Lights under surfboards could deter shark attacks - study,
Sue Gray will not take up new nations and regions role,
Premier League footballer questioned over rape claims,
Jury shown video of father slapping Sara Sharif,
Spain braces for torrential rain as new weather system reaches Med coast,
MPs back end of House of Lords hereditary peers,
Serving police officer arrested on suspicion of supporting Hamas,
COP29: In Donald Trump’s shadow,
'Seminal review can end Premier League deadlock',
"Lineker to stop hosting Match of the Day, BBC confirms",
'Crisis for referees & fuel for toxic fan conspiracies',
Wittich 'steps down' as F1 race director,
Hill scores as Dolphins beat Rams to end losing run,
"Rugby player, 24, won't return over mental health",
Flynn aims to stand for SNP at Holyrood election,
'My autistic son is like a prisoner in hospital',
Jury shown video of father slapping Sara Sharif,
Trump has full control of Washington - but he won't always get his way,
Sara Sharif’s father tells court daughter 'died because of me',
'Too small' pension funds hold back growth - Reeves,
Working birthday for King Charles at 76,
Pharmacies vote to cut opening hours in funding protest,
Charity wants testing of prostate cancer high risk,
"Homebase collapses into administration with 2,000 jobs at risk",
Málaga evacuates thousands due to flooding as Spain issues more alerts,
Suspended referee Coote facing fresh allegations,
British Museum given £1bn of Chinese ceramics,
Bahrain activists criticise UK over King Hamad's honorary knighthood,
Why the name of a national park was switched from Snowdonia to Eryri,
Will Elon Musk be able to cut $2 trillion from US government spending?,
Zendaya: Working with Tom Holland is 'second nature',
The masked headliners freshening up Download festival,
French headteacher describes spiral of events that led to teacher's beheading,
Actor Timothy West dies aged 90,
"Assisted dying law would hit other NHS care, says Streeting",
Car buyer payouts over loan scandal could be delayed,
Giant wall of dust sweeps across central California,
Daniel Khalife denies asking Iran for help after prison escape ,
Activist takes own life in protest at Iranian regime,
Women jailed over sadistic monkey torture videos,
Presidents Roasting By An Open Fire,
Germany’s deepening political crisis,
Does Kane's criticism expose England cracks?,
"IOC needs to 'protect female sport', says Lord Coe",
PGMOL taking new Coote allegations 'very seriously',
Brady issues warning over football regulator plans,
Some players 'lucky enough' to face Pumas - Farrell,
How I played for England after having a stroke,
'I'm offered sex as a favour because I'm disabled',
Government admits new oil field approved unlawfully,
NI teachers unions ballot members on strike,
Killer 'might have slept' as partner died at bedside,
"Mohamed Al Fayed's brother Salah also abused Harrods staff, women tell BBC",
"UK must rebuild post-Brexit relations with EU, says Bank of England boss",
UN climate talks 'no longer fit for purpose' say key experts,
Girl who died after leaving police vehicle on M5 named,
"University cash crisis to get worse despite tuition fee rise, regulator says",
Streeting faces pushback over assisted dying stance,
"I'm the worst parent, Sara Sharif's dad tells jury",
"Prison officers deal drugs and ask inmates for sex, BBC told",
Coroner issues 'cancel culture' warning after Oxford student took own life,
Whistles and boos at France-Israel football match,
"Bank Holiday airport chaos made worse by password issue, report says",
Trump's pick of Huckabee and Witkoff a clue to Middle East policy,
The appointments to Trump's top team so far,
Why is Kamala Harris still asking for campaign donations?,
Who is Trump intelligence pick Tulsi Gabbard?,
Fossil fills 70-million-year gap in understanding,
Eva Longoria says her family no longer lives in 'dystopian' US,
Diamond necklace linked to Marie Antoinette sells for $4.8m,
South Africa cuts supplies to thousands of illegal miners hiding underground,
Friday is last chance to see a supermoon in 2024,
Satirical news site The Onion buys Alex Jones's Infowars at auction,
"Boy, 2, 'lucky to be alive' after bully dog attack",
Folic acid added to flour to lessen birth defects,
HRW accuses Israel of war crime of forced displacement in Gaza,
Meta fined €798m over 'unfair' Facebook Marketplace,
Reeves in radical pension shake-up to boost growth,
Climate COP Out?,
Trump's new top team,
'A night of redemption for Carsley offers real hope for Tuchel',
'He could be one of world's best' - what next for Kelleher?,
George says England have 'evolved' since World Cup,
Raducanu feeling fit as GB launch BJK Cup challenge,
"I'm not going to lose, did you hear me? - Tyson",
Littler fights back to reach Grand Slam quarter-finals,
Cancer patient in Wales denied life-extending drug,
Thieves grab Harris Tweed and cashmere on 'lawless' Royal Mile,
Pay offer being considered by health unions,
"I'm the worst parent, Sara Sharif's dad tells jury",
"I felt enormous guilt, says ex-MP in honeytrap scandal",
Four teenagers and a man guilty of murdering boys in mistaken identity case,
Last supermoon of 2024 captured in stunning photos across the UK,
Elon Musk adds Microsoft to lawsuit against ChatGPT-maker OpenAI,
Davina McCall recovering after brain tumour surgery,
Children in Need raises more than £39m,
Mortgage costs rise despite interest rate cut,
Police defend investigation into journalist Allison Pearson's social media post,
Nightclub closed after security guard charged with rape,
Met police officer sacked for viewing Sarah Everard files,
UK snow and ice warnings issued as Arctic air sweeps in,
Five takeaways from Trump’s first week as president-elect,
The appointments to Trump's top team so far,
"What RFK Jr could do on US vaccines, fluoride and drugs",
Two of UK's biggest clubs get in-house drug testing,
The Papers: 'Pray' for Davina and '£280 hike to bills',
"'You can do anything', says Belfast's Grammy nominated star",
'Blame Mike' - absurdity and appeal of Tyson v Paul ,
X users jump to Bluesky - but what is it and who owns it?,
Welsh advert causes Celtic confusion in Glasgow,
More than 100 seek compensation over cruise virus,
"North Korean troops in Ukraine ‘grave escalation’, Scholz tells Putin",
Elon Musk met Iran's UN ambassador in New York,
Netanyahu aide investigated over 7 October document changes,
Pro-Russia bill triggers protests in Georgia breakaway region,
"Harry one of two claimants still suing Sun publisher, court told",
The Week: Assisted dying and pension reform,
How Scotland's human blur Doak left £77m man in daze,
'Three or four games in one' as Ireland 'win ugly' ,
Boulter & Raducanu put GB into BJK Cup quarter-finals,
'Blame Mike' - absurdity and appeal of Tyson v Paul ,
Amorim vows to restore Man Utd to where club 'belongs',
Boulter powers GB into BJK Cup quarter-finals,
"Floods, ceiling holes and loose sockets - life in a new-build",
What should happen with the Rosebank and Jackdaw oil fields?,
Minister at NI-Belarus match despite government guidance,
Ambulance 'failure' played role in motorbike death,
Zelensky says war will 'end sooner' with Trump as president,
Farmers protest as Starmer defends Budget,
"'Genuine impasse' at top of government about social care plan, insiders say",
Melting glaciers leave homes teetering in valley of jagged mountains,
Woman found dead in car boot named by police,
Lord Blunkett injured in Tube platform gap fall,
Watch: Georgia election chief doused with paint,
Senators call for probe into Musk's alleged contact with Russia,
UK Pizza Hut to raise funds after Budget tax hikes,
Eight dead after stabbing at school in eastern China,
"Malcolm X’s family sues FBI, CIA and NYPD over his murder",
UK snow and ice warnings as weather turns colder,
"United by loyalty, Trump's new team have competing agendas",
Karoline Leavitt to become youngest White House press secretary,
Fact-checking RFK Jr's views on health policy,
Watch: A look at Trump's new top team... in 74 seconds,
A sexually obscene phone call - and my two-year ordeal getting police to act,
The Papers: '£1bn boost for buses' and Italy-style 'migrant deals',
'We've had more visitors in two days than 30 years',
Grandma with chunky sunglasses becomes unlikely fashion icon,
"Floods, ceiling holes and loose sockets - life in a new-build",
'I get stopped for autographs - people think I'm Harry Styles',
'We are dying every moment' - the Afghans risking their lives to reach UK,
Tyson vs Paul fans 'furious' at Netflix problems,
Volcanoes once erupted on the far side of the moon,
Sixth typhoon in a month makes landfall in Philippines,
Four arrests after M62 crash during police pursuit,
US reports first case of emerging mpox strain,
Amsterdam violence exposes tensions in society and spills over to politics,
Molly-Mae Hague 'shocked' by Tommy Fury split,
Newscast: Trump the Peacemaker?,
Windies chase 219 for first win of T20 series against England,
Errors and England's Groundhog Day defeats keep stacking up,
Justice served in Wales draw against Turkey - Bellamy,
'Everything almost perfect' for Bompastor and Chelsea,
Last-second Jamaica goal seals thrilling tie with England,
Belfast traders 'not worried' about traffic as Christmas market opens,
'I want my womb removed but doctors say I'm too young',
Four arrests after M62 crash during police pursuit,
SNP plans to cut staff at party headquarters ,
Private nursing homes 'used to secretly house women and babies',
Biden allows Ukraine to strike inside Russia with US-supplied missiles,
"Police hunt husband of Harshita Brella, whose body was found in car boot",
Top Republican says Trump nominees are ‘disruptors’ ,
Chris Mason: Farmers head to Westminster as inheritance tax anger grows,
Starmer to meet Chinese President Xi at G20 summit,
"Fixing social care is urgent, says minister, after claims of deadlock",
Robbie Williams hits back at ex-Take That manager,
