title,
Mexico's fight to sue US gun manufacturers for $10bn,
Streaming is driving a 'golden age' for Indian drama,
Derry Girls star: A private Channel 4 wouldn't make this show,
Sir David Amess: How MP's killer was a textbook radicalisation,
Sasaram: How thieves stole a 60-foot-long bridge in Bihar,
Imran Ahmad Khan: What happens when an MP is convicted?,
"Scottie beamed, Rory roared, Tiger back - Masters review",
Northern Ireland v England: 'Special' to play at sold-out Windsor Park - Callaghan,
MLB: Watch Miami Marlins' Jazz Chisholm Jr take stunning one-handed catch,
Freddy Rincon: Former Colombia captain in critical condition after car crash,
"Champions League: Atletico Madrid must close off 5,000 seats for Man City match",
Eya Guezguez: Tunisian Olympic sailor dies aged 17 after training accident,
Huddersfield go third after beating Luton,
Boris Johnson and Rishi Sunak reject calls to resign over lockdown fines,
Ukraine: The critical fight for 'heart of this war' Mariupol,
Prices rising at fastest rate since 1992,
Brooklyn shooting: Person of interest named in New York subway attack,
UK officials investigate 74 child hepatitis cases,
P&O Ferry detained over deficiencies - coastguard,
Insulate Britain: Judge 'inspired' by activists after M25 protest,
Police anti-terror IT system was 'not fit for purpose' - former officer,
Tropical Storm Megi: Rescuers race to find survivors as death toll rises,
Shanghai lockdown: iPhone maker halts operations at China sites,
Johnny Depp and Amber Heard: Heard giving 'performance of her life',
US cryptocurrency expert jailed for helping North Korea evade sanctions,
Real Madrid 2-3 Chelsea (Agg: 5-4 aet): Blues suffer agonising Champions League exit,
The Papers: PM refuses to quit and Russia plans eastern assault,
27-year-old refugee Ludmyla Chyrkova is heading home,
Ros Atkins on… PM’s lockdown party fine,
"Holy grail of WW2 watches sells for £12,000",
Energy bills: Denbigh venue cancels winter weddings due to costs,
Marks & Spencer: Flagship Oxford Street store to be demolished,
Turner Prize 2022: Trafalgar Square whipped cream artist among nominees,
Partygate fines: Are Boris Johnson and Rishi Sunak finished?,
Online porn: 'My pupils ask me about violence',
Football academies: A failed dream 'sends you to a dark place',
Why do so few rape cases go to court?,
Why Nigeria's historic dye pits in Kano risk closure,
How facial recognition is identifying the dead in Ukraine,
My Job: 'I like breaking the prison officer stereotype',
Thomas Tuchel: Chelsea boss says players were unlucky after Champions League epic,
Northern Ireland v England: Lionesses beat NI in front of record crowd,
Fernandinho: Pep Guardiola surprised by midfielder's plans to leave Manchester City,
Bayern Munich 1-1 Villarreal (1-2 agg): Spanish side stun Bayern with late Chukwueze winner,
Kenny Shiels: NI boss says 'women are more emotional than men',
Andrew McDonald named coach of Australia's men's cricket team,
Grieving Russians can't believe talk of war crimes in Ukraine,
Ukraine: Fugitive Putin ally Medvedchuk arrested - security service,
Ukraine war: Was a cluster bomb used in station attack?,
Donbas: Battle in east Ukraine expected to be bloody and decisive,
Ukraine round-up: Putin defends 'necessary' invasion and Kyiv averts cyber-attack,
Ukraine conflict: How will we know if Russia used chemical weapons?,
Ukraine war in maps: Tracking the Russian invasion,
Ukraine conflict: Why is Russia losing so many tanks?,
UK to sign deal to send asylum seekers to Rwanda for processing,
Minister Lord David Wolfson quits over Covid law-breaking at No 10,
NHS faces an Easter 'as bad as any winter',
Police arrest suspect in New York subway shooting 'without incident',
Beauty firm L'Occitane keeps Russian stores open,
Freddy Rincon: Former Colombia captain dies following car crash,
Durban floods: South Africa floods kill more than 300,
Covid: Restrictions on Wales' businesses to end,
Patrick Lyoya: Video shows fatal US police shooting of black man,
"Ukraine attention shows bias against black lives, WHO chief says",
Cash to help protect homes from repeat flood damage,
Nasa scientists spy 'largest comet ever seen',
Bodybuilding champion Cedric McMillan dead at 44,
Ukraine war: Kyiv's battle for justice over alleged Russian war crimes,
Ukraine war: Is Russia committing genocide?,
Collecting the dead in Bucha,
Ukraine round-up: Biden and Macron at odds over Putin 'genocide',
Ukraine war in maps: Tracking the Russian invasion,
Ukraine: British man fighting in Mariupol 'forced to surrender',
War in Ukraine: Separatist leaders targeted in new UK sanctions,
Ukraine: Fugitive Putin ally Medvedchuk arrested - security service,
The Papers: 'Worst to come for PM' and Rwanda to take UK migrants,
How we verify social media posts from the war in Ukraine,
Mountain rescue teams trial drone technology to find lost climbers,
Douglas Stuart: Prize-winning author 'feels like an imposter',
Doctor Who: 'I wanted The Doctor to whisk me away from everything awful',
Bollywood wishes Ranbir and Alia well as they marry,
Killing Eve: Liverpool costume show celebrates Jodie Comer's Villanelle,
Inflation: Five things that are going up in price and why,
Mutations across species reveal clues to ageing,
Is a virus we all have causing multiple sclerosis?,
Ukraine war: Farmers stretched to the brink in Odesa,
The Olympic champion who turned his back on the Russian regime - and why few in sport will follow,
Brazil's indigenous communities fear mining threat over war in Ukraine,
"Boom time for dog walkers, sitters and trainers",
Genetic testing: Babies with rare illnesses given hope,
How the rising cost of living crisis is impacting Nepal,
Why people get away with hate speech in India,
Online porn: 'My pupils ask me about violence',
What is the UK's inflation rate and why is the cost of living going up?,
Pep Guardiola: Man City 'in big trouble' despite 'deserved' Champions League win over Atletico,
Liverpool 3-3 Benfica (agg: 6-4): Jurgen Klopp's side set up Villarreal semi-final,
Allyson Felix: US Olympic great to retire at end of season,
World Snooker Championship: Iran's Hossein Vafaei to make Crucible debut,
Marcus North pulls out of running to be England managing director of men's cricket,
Atletico Madrid 0-0 Man City (agg: 0-1): Mature City hold off Atletico in fiery encounter to reach semis,
Russian warship Moskva has sunk - defence ministry,
Ukraine's President Zelensky to BBC: Blood money being paid for Russian oil,
Rwanda asylum seekers: UK could send first people 'within weeks',
Elon Musk 'not sure' his takeover bid for Twitter will be successful,
Harry and Meghan visit Queen on way to Invictus Games,
"Depp and Heard marriage ended in 'mutual abuse', says therapist",
Crypto boss says fraudsters have 'special place in hell',
El Shafee Elsheikh: Guilty verdict for Islamic State jihadist,
Operation Brock: M20 traffic controls scaled back ahead of Easter,
North Korean hackers target gamers in $615m crypto heist - US,
Enfield Southgate Conservatives: Chair resigns over Nazi photo,
Online predators targeting live-streaming - charities,
Lyon 0-3 West Ham United (1-4 on aggregate): Hammers reach first European semi-final in 46 years,
Sunken Russian warship Moskva: What do we know?,
Behind the scenes in Zelensky's modern HQ,
'I'm shocked by my church leaders in Moscow' - priest in Ukraine,
Ukraine: Returning home to a country still at war,
Aiden Aslin: Family appeal for safety of Briton 'captured in Ukraine',
Why has Russia invaded Ukraine and what does Putin want?,
Ukraine round up: Flagship Russian warship sinks,
Ukraine war in maps: Tracking the Russian invasion,
The Papers: Migrant plan 'inhumane' and Sussexes visit Queen,
Shanghai lockdown: How angry netizens test China's 'Great Firewall',
'I won't give them hate' - brother of British victim of Islamic State,
Brazil: Wild animals take to the streets in Rio de Janeiro,
Quiz of the week: Why is Richard Osman leaving Pointless?,
Southend Council to mow parks and grass once a year,
Africa's week in pictures: 8-14 April 2022,
Jerusalem on edge as festivals fall amid tensions,
Durban floods: Is it a consequence of climate change?,
Operation Mincemeat: The Welsh drifter who helped end WW2,
The book that sank on the Titanic and burned in the Blitz,
Both my girls have Crohn's and it's heart-breaking,
Sienna Miller: Anatomy of a Scandal actress on the 'ignorance' of privilege,
UK asylum deal: Is Rwanda a land of safety or fear?,
Rangers 3-1 Braga (3-2 agg): Kemar Roofe extra-time winners puts Scots into semi-final,
Barcelona 2-3 Eintracht Frankfurt (3-4 agg): German side reach semi-finals,
Tyson Fury v Dillian Whyte: World champion 'not thinking about retirement',
Super League: Wakefield Trinity 4-34 Castleford Tigers,
Man City v Liverpool: I should become more selfish - Jack Grealish,
"Emma Raducanu 'ready to lead' Great Britain in Billie Jean King Cup, says Anne Keothavong",
FA Cup: Watch all the goals from Man City's route to FA Cup semi-final,
Local elections: 'I honestly don't have a clue',
Ukraine war: No quick return to normal for scarred Bucha,
"UK Rwanda asylum plan against international law, says UN refugee agency",
Covid China: Elderly deaths contradict Shanghai figures,
Prince Harry and Meghan land in Netherlands for Invictus Games,
Homes for Ukraine: Robert Jenrick takes in Ukrainian refugee family,
Climate change: Key UN finding widely misinterpreted,
Council tax rebate: Warning issued over new scam pretending to offer £150,
Twitter board takes action to fight Musk bid,
Dua Lipa's Future Nostalgia tour confirms she's Britain's best pop star,
River pollution: Man infected with sewage-linked parasite,
Undocumented lotto winner struggles to claim prize,
Salah Abdeslam: Accused Paris attacker apologises to victims,
Another 40 arrests after protests at oil depots,
"Chernihiv is silent, after having been under constant attack from Russian forces",
Sanctioned Russian oligarchs linked to £800m worth of UK property,
Ukraine's battle for control of its skies,
Newspaper headlines: Rwanda plan 'will fail' and 'SAS train Kyiv forces',
Ukraine war: Minesweeping dog helps clear Chernihiv of Russian explosives,
'My cancerous tumour was as big as a kettle bell',
Week in pictures: 9-15 April 2022,
How Instagram opened a new world for Welsh quilting,
Ukraine war: Grandmother 'horrified' by capture of British fighter,
Brain cancer DNA research hopes to speed up diagnosis,
Chester Zoo welcomes birth of 'tiny' rare monkey,
Larsen Roberts: 'Slideathon' in memory of boy with brain tumour,
What's the problem with calories on restaurant menus?,
DR Congo conflict: Hiding on top of a hill to escape the rebels,
'The Post Office interrogated me for hours',
Merle Oberon: India's forgotten Hollywood star,
Mastermind: Inside the world of competitive quizzing,
FA Cup semi-finals: Man City-Liverpool & Chelsea-Crystal Palace at Wembley,
Derby County 2-1 Fulham: Rams maintain survival hopes and make Fulham wait on promotion,
Sean Dyche: 'A huge gamble that smacks of blind panic by Burnley's owners',
Heineken Champions Cup: Bristol 29-35 Sale (agg 39-44),
World Snooker Championship: Ronnie O'Sullivan continues quest for seventh title as he marks 30th year at Crucible,
Emma Raducanu: Great Britain number one beats Tereza Martincova in Billie Jean King Cup,
Conor Benn v Chris van Heerden: British welterweight targets world title tilt,
UK's Rwanda asylum plan the 'opposite of nature of God' - Welby,
Russian warship: Moskva crew 'shown for first time since sinking',
Whatever happened to the Novavax Covid vaccine?,
Johnson to visit India in bid to boost defence ties,
Prince Charles remembers victims of war in Easter message,
Patrick Lyoya: Could rethink of US police traffic stops save lives?,
Invictus Games: Harry says world is united with Ukraine,
Ukraine war scams: Cybercriminals stole my identity,
Ukraine war: Russia bans Boris Johnson from country over Ukraine war,
South Africa flooding: 'I had thought my house was safe',
Covid adviser Devi Sridhar sent white powder and mask in post,
Ukraine war: L'Occitane U-turn as it closes Russian shops,
Extinction Rebellion: Six arrested after Olympians scale oil tanker,
Ukraine: Online posts 'transform' war crimes documentation,
Ukraine round-up: Residents rebuild Bucha as Russia bans UK PM,
Sunken Russian warship Moskva: What do we know?,
Newspaper headlines: 'Ungodly' Rwanda plan and drug scandal claims,
I decided not to let cancer stop me dating,
Invictus Games: Prince Harry and Meghan join opening ceremony in the Netherlands,
Man opens tiny cafe in garage between Bristol houses,
'Bell-ringing is more than a call to prayer',
BMX: Childhood memories feature in 'untold story',
US zoo celebrates 50 years of giant pandas,
Nigeria's Chibok girls: Why was this former captive treated differently?,
Climate change: 'We're making wine in Norway',
Liverpool: Have Reds struck blow over Manchester City after FA Cup semi-final win?,
Penguin power and the 'dream job' in Antarctica,
Bleed kits in memory of stabbed Essex teenager Liam Taylor,
Conor Benn v Chris van Heerden: British welterweight secures second-round knockout in Manchester,
Emma Raducanu bathes blisters in surgical spirit as injuries frustrate her,
Liverpool beat Manchester City 3-2 in FA Cup semi-final - highlights,
Sadio Mane: Watch every angle of Liverpool's third goal against Man City in FA Cup semi-final,
"World Snooker Championship 2022: Mark Selby through, Ronnie O'Sullivan leads",
Manchester City 2-3 Liverpool: Jurgen Klopp praises 'one of best ever' displays in FA Cup semi-final win,
Ukraine war: Mariupol defenders will fight to the end says PM,
"Rwanda asylum critics have no solutions, says Patel",
Piers Morgan says exit from ITV's Good Morning Britain was 'a farce',
Covid: Thousands of vaccinators get permanent NHS roles,
Shanghai: China reports three dead in latest Covid outbreak,
Christmas savings clubs money to be protected by new laws,
Unrest in Sweden over planned Quran burnings,
Ukraine war: Trucks stuck at Poland-Belarus border as EU sanctions deadline passes,
Next and finance firms buy JoJo Maman Bebe,
Lumo train passengers' panic after emergency stop,
Doctor Who: Former companions to join Jodie Whittaker's farewell,
Sturgeon reported to police for not wearing mask ,
Easter: Snowdonia mountain path covered in human faeces - guide,
Ukraine war: Germany's conundrum over its ties with Russia,
The elderly who can't flee their Ukrainian homes,
Why has Russia invaded Ukraine and what does Putin want?,
Older residents of the east reluctant to hit the road,
Ukraine round-up: Ukraine defies Mariupol deadline as Kharkiv shelled,
Newspaper headlines: MPs attack Welby 'rant' and PM 'led boozy party',
Why I didn't use my real name at work,
Nigeria's Spider-Man fighting for a cleaner society,
'I am only the UK's sixth black female QC',
In pictures: Mountain bikers descend snowy peak,
Hull maritime pictures have decades of grime removed,
Captagon: Jordan's undeclared war against Syria drug traffickers,
How well have Scotland and the UK coped with Covid?,
Sri Lanka healthcare on verge of collapse in economic crisis,
Wales' hospitality businesses struggle to recruit staff,
'I felt more joy than I thought possible',
I decided not to let cancer stop me dating,
Chelsea 2-0 Crystal Palace: 'Blues again show ability to thrive amid chaos',
Liverpool: Virgil Van Dijk says 'almost impossible' quadruple would be 'dream',
Match of the Day 2 analysis: How Bruno Guimaraes won the game for Newcastle,
"Garth Crooks' Team of the Week: Mane, Ronaldo, Werner, Mount",
World Snooker Championship 2022: Ronnie O'Sullivan beats David Gilbert,
West Ham 1-1 Burnley: Hosts salvage draw after Ashley Westwood horror injury,
Boris Johnson sorry for party as Labour calls apology a joke,
Ukraine war: Kyiv's allies pledge more weapons to help win war,
Prince Harry says he is making sure the Queen is protected,
The Zomato and Swiggy riders risking their lives to deliver food,
Fake reviews to be illegal under new rules,
Highway Code: Watching TV in self-driving cars to be allowed,
Johnny Depp v Amber Heard: Actor says he never hit a woman,
Cristiano Ronaldo: Liverpool and Man Utd fans unite for fan-led minute of applause at Anfield,
Netflix loses subscribers for first time in more than 10 years,
Hepatitis cases detected in children in Europe and the US,
Urine bugs may be a sign of aggressive prostate cancer,
'Rare condition gives me TV static in my vision',
In maps: Russia builds up troops in new offensive,
Ukraine round-up: Lviv counts civilian dead and credible sinking warship video,
Ukraine war: How a BBC journalist's family escaped the country,
"Ukraine children: Killed as he escaped, Elisei is one of 200 child victims",
Ukraine war: Donbas tourist town braces for Russian assault,
The Papers: 'PM without shame' and 'MPs told to block inquiry',
Why this face recognition firm is so controversial,
"Climate Change, Albinism and Me",
CEO Secrets: 'I begged my dad not to give out business cards',
Wayne Quilliam: Photographing the diversity of Aboriginal Australia,
Falklands War: Injured veteran and nurse reunited after 40 years,
Forced adoptions: Nurse speak out over pressure on unmarried mothers,
War in Ukraine: A separated family reunited,
The 24-year-old helping people talk about their mental health,
Falklands veteran recalls HMS Coventry bombing and rescue,
Emmanuel Macron: From political outsider to president,
Partygate: Which Downing Street parties have resulted in fines so far?,
Why Koreans could soon become a year younger,
Covid-19 in the UK: How many coronavirus cases are there in my area?,
'People fear for their jobs if they report bullies',
Are there affordable ways to cut your heating bill?,
When do parents find out about primary-school places?,
Daffodils to treat Alzheimer's could be Welsh hill farming's future,
Ulcerative colitis: 'I was going to the toilet up to 30 times a day',
Why women vote for India PM Narendra Modi's BJP,
French elections: Macron v Le Pen and two visions for France,
"Liverpool 4-0 Manchester United: Defeat 'humiliating', says Ralf Rangnick",
Fulham 3-0 Preston North End: Whites clinch Premier League return,
World Snooker Championship 2022: Neil Robertson beats Ashley Hugill in first round,
Tyson Fury: Heavyweight says he has 'zero' connection with Daniel Kinahan,
"Liverpool 4-0 Manchester United: Luis Diaz, Mohamed Salah & Sadio Mane score at Anfield",
NI election 2022: Who should I vote for? Compare party policies,
May 2022 UK elections: How to vote,
Partygate: Boris Johnson seeks to delay vote on investigation,
French election: Macron and Le Pen clash in TV presidential debate,
Queen celebrates 96th birthday in Sandringham,
Covid: Woman caught virus twice within record 20 days,
Bourne End murder inquiry under way after three bodies found,
Russian oligarch lambasts country's 'massacre',
Scott Morrison: Australia PM faces backlash over 'blessed' disability remark,
Tesla profits soar as customers pay more,
"Most protected areas do not benefit wildlife, study says",
MPs say asbestos must go from public buildings within 40 years,
Johnny Depp faces questioning in case against ex-wife Amber Heard,
Alec Baldwin: Rust film producers were indifferent to gun safety - report,
Pandemic lockdowns boosted trend to use less make-up,
Ukraine round-up: Mariupol civilians remain trapped and Russian oligarch decries 'massacre',
How many Ukrainians have fled their homes and where have they gone?,
Donbas: Why Russia is trying to encircle Ukraine's east,
Ukraine war: Mariupol fighters' relatives tell of bitter pride,
Ukraine war in maps: Tracking the Russian invasion,
Russia releases video of intercontinental ballistic missile launch,
Ukraine war: Holocaust survivor aged 91 among Mariupol's civilian dead - reports,
"The Papers: 'Palace shock' at Harry interview, and Queen is 96",
The young rebels fighting for democracy,
'Sip and shop': The retailers tempting you in with alcohol,
French election: Voters react to the Macron and Le Pen TV debate,
Queen gets her own Barbie for Platinum Jubilee,
'Rare condition gives me TV static in my vision',
Steve Coogan says Jimmy Savile drama The Reckoning 'will vindicate itself',
"Star Wars toy bought for 99p sells for £2,000",
Netflix hints at password sharing crackdown as subscribers fall,
"Climate change, albinism and me",
The Zomato and Swiggy riders risking their lives to deliver food in 10 minutes,
The Easter egg that's gone uneaten for more than 70 years,
'A great sense of humour': But what makes the Queen laugh?,
What did Boris Johnson tell Parliament about parties?,
Covid: What is the guidance on mask-wearing now?,
Shanghai lockdown: Whole communities relocated in anti-Covid drive,
Happening director Audrey Diwan says abortion should not be 'a silent topic',
Liege-Bastogne-Liege: Cycling's oldest spring classic celebrates 130 years of torture,
"KGF 2, RRR, Pushpa: The southern Indian films winning on Bollywood's turf",
Struggling to survive in cash-starved Afghanistan,
Sudan anger over racist slur caught on air at Bashir trial,
Covid-19 in the UK: How many coronavirus cases are there in my area?,
Man City 3-0 Brighton: City go back top with six games to play,
Chelsea 2-4 Arsenal: Mikel Arteta vindicated as Eddie Nketiah inspires stunning Gunners win,
Joe Root named Wisden's leading cricketer in the world for 2021,
"World Snooker Championship 2022: John Higgins goes through, Ding Junhui out",
British cyclist Katie Archibald says female and transgender athletes 'let down' by governing bodies,
Alli's role in Everton draw can be 'big starting point',
Match of the Day analysis: How Man City leapfrogged Liverpool,
Mariupol steelworks: 'We have wounded and dead inside the bunkers',
Mariupol: Satellite images suggest mass graves dug near besieged city,
Madeleine McCann: Portuguese authorities declare formal suspect,
Boris Johnson and India's Narendra Modi to discuss defence and trade,
Large hadron collider: A revamp that could revolutionise physics,
Earl and Countess of Wessex: Prince Edward and Sophie postpone Grenada trip,
Cancer: Huge DNA analysis uncovers new clues,
Co-op supermarket scraps yoghurt use by dates in bid to cut food waste,
Johnny Depp and Amber Heard face off in court,
"Longest Covid infection lasted more than 16 months, tests show",
Kardashians deny faking Roblox sex tape scene,
Florida lawmakers have stripped Disney of special tax status,
"The Papers: 'The gig is up, Boris' and 'Johnson buckles'",
Ros Atkins On… The PM and the ministerial code,
Quiz of the week: Which Doctor Who companions will be back in the Tardis?,
France election: What far-right leader Marine Le Pen said before… and now,
The German towns in Paraguay with a surge in European immigrants,
Have we seen peak Netflix?,
Africa's week in pictures: 15-21 April 2022,
The Queen's Guard play Happy Birthday to celebrate Queen's 96th birthday,
Westminster Abbey will open roof for first time to celebrate Platinum Jubilee,
Rudy Giuliani revealed on The Masked Singer TV show,
Rare tiny Brontë book could set $1.25m sale record,
Whisky and visas could be part of a UK-India trade deal,
Covid: Why are so many people catching it again?,
Working with assertive China a must - New Zealand PM Jacinda Ardern,
Is the energy price cap wrong?,
Mid-day meal plan struggles to feed India's hungry students,
Heartstopper: Teen LGBTQ+ Netflix drama pushing the envelope,
Why Argentina is embracing cryptocurrency,
Katty Kay: Why inflation in US is bad for Ukraine,
Logan Mwangi: How CCTV helped police catch his murderers,
French election: Le Pen impresses but Macron holds firm in TV debate,
What did Boris Johnson tell Parliament about parties?,
Boris Johnson's India visit takes place against partygate backdrop,
Erik ten Hag: Manchester United's new boss and the challenges he faces,
Burnley 2-0 Southampton: Clarets keep Premier League survival hopes alive,
"World Snooker Championship 2022: Judd Trump through, Mark Williams leads",
Wimbledon ban on Russian players is discrimination - Andrey Rublev,
Charles Leclerc: Ferrari driver says he and Max Verstappen 'hated each other' in karting days,
UCI Track Nations Cup: Great Britain claim double silver in team pursuit in Glasgow,
Mariupol: Driving into the 'apocalypse' to save mum and dad,
Ukrainians injured or killed by unexploded ammunition,
Ukraine round-up: Putin backs off storming of Azovstal as Mariupol 'mass graves' found,
Ukraine war: World Bank warns of 'human catastrophe' food crisis,
"British men captured in Ukraine being looked after, says Russia",
Ukraine war in maps: Tracking the Russian invasion,
UK elections 2022: A really simple guide,
French election: Macron and Le Pen trade taunts as campaigning ends,
Madeleine McCann: Parents welcome declaration of formal suspect,
Post Office scandal victims still waiting for compensation,
Beach photos mark Prince Louis' birthday,
Florida's governor signs law revoking Disney powers,
Inquiry into oligarch donating to royal hospital,
P&O Ferries: Spirit of Britain cleared to sail after inspection,
Supermarkets set limits on sale of cooking oil,
Gun deaths were the leading killer of US children in 2020,
"Ukraine war: Russia aiming for full control of south, commander says",
Coronavirus levels continue to fall across the UK,
Women asked if bladder drug should be available to buy,
"Newspaper headlines: Tanks for Ukraine, and new Partygate fines",
'Doing Parkrun at 95 is something different',
Week in pictures: 16 - 22 April 2022,
