title,
The Papers: 'No heat to eat' as 'Sunak told: slash more taxes',
Small business owners: 'We're taking the hit',
War in Ukraine: 'Pets are getting left at train stations',
"Plans for giant, lit-up dome approved for Olympics site",
Spring Statement: One family's cost of living experience,
Goldman Sachs boss David Solomon set to DJ Lollapalooza,
Taliban schools U-turn 'a devastating day' for Afghan girls - Malala Yousafzai,
'I was shocked to find out I now have four kidneys',
Ash Barty: Australians react to world tennis number one's shock retirement,
William Collins: Giant memorial built without permission,
"Life of Madeleine Albright, the Czech-born US political trailblazer",
Oscars 2022: Which film might be named fan favourite?,
Covid boosters: Who is being vaccinated?,
My Job: 'Covid has made it impossible to switch off',
"Zimbabwe by-elections: New party, same fears of dirty tricks",
Refugees: 'Rebuilding our life after home was bombed',
Covid-19 in the UK: How many coronavirus cases are there in my area?,
England crush Pakistan at World Cup to move towards semis,
Eidevall '100% sure' Arsenal will advance after first-leg draw,
Chelsea: Club allowed to sell tickets after government alters licence,
Ashleigh Barty retires: Her time at the top was too short for tennis - but not for her,
England captain Kane keen to 'shine a light' on Qatar issues,
"World Cup 'hurt' driving Wales for play-offs, says Bale",
Ukraine war: Destruction of cities shown from above,
Zelensky: How Ukraine's president uses addresses to set his agenda,
The Ukrainian refugee who loves to laugh at school in Poland,
What sanctions are being imposed on Russia over Ukraine invasion?,
A Kremlin adviser resigns and Ukrainian territory regained - Ukraine's latest war round-up,
Ukraine's recruits swap spreadsheets for sniper rifles to defend Kyiv,
How many Ukrainians have fled their homes and where have they gone?,
UK Covid infections climb by a million in a week,
PM backs calls for P&O Ferries boss Peter Hebblethwaite to resign,
War in Ukraine: Estimated 300 dead in Mariupol theatre strike,
Ukraine war: JK Rowling hits back at Putin's 'cancel culture' comment,
Kyrell Matthews: Mum and partner jailed for killing toddler son,
"David Amess killing: Ali Harbi Ali told police 'I done it, I killed an MP'",
EU signs US gas deal to curb reliance on Russia,
"Ukraine: Nato will respond if Russia uses chemical weapons, warns Biden",
Manchester Arena attack: Mum wants right to register son’s death,
Bute Park: Three jailed for doctor's homophobic murder,
Crimean-Congo haemorrhagic fever case found in UK,
Simon Coveney's visit to Belfast interrupted by security alert,
Ukraine war: A dangerous escape on the 'Rescue Express',
Ukraine War: Civilians abducted as Russia tries to assert control,
Ukraine war: The priest shot at a checkpoint,
Defiant Ukrainian troops tell Russians: 'Go home while you're still alive',
War in Ukraine: What Ukraine is getting right,
"Ukraine war: Return to Irpin, the town destroyed in the battle for Kyiv",
Ukraine-Russia: The 76-year-old artist taking on Putin,
Ukraine daily roundup: World leaders show united front at major summits,
'Shame on you': How President Zelensky uses speeches to get what he needs,
What sanctions are being imposed on Russia over Ukraine invasion?,
Ukraine war: Dnipro orphans find sanctuary in Scotland,
Queen's delight as teapot factory comes to her,
Bridgerton: Mixed responses from critics to second series,
Leeds teacher tackling poverty by giving 'every head a bed',
"Michael Bublé: Multi-Grammy winner on Bond themes, romantic gifts and new album",
"Ferrell should have had Oscar nomination for Elf, says Curtis",
‘P&O Ferries weren’t just jobs - they were our homes’,
Quiz of the week: What did gamers do for Ukraine?,
The Papers: Biden's chemical weapon warning and 'Shame on' P&O,
"Australia floods: 'We're resilient, but how about helping us?'",
Gordon Ramsay sends chef to help Biggleswade school canteen,
Netflix boss Scott Stuber says Oscar best picture win would be the dream,
"Plans for giant, lit-up dome approved for Olympics site",
Is North America's Arctic vulnerable to Russia?,
Ukraine war: The road to safety for Ukraine's cancer children,
Say Yes To Tess: Turning a doomed election campaign into a musical,
Spring Statement: Is this really the biggest personal tax cut for 25 years?,
Notts County and the conman: Following your team through a football scam,
Covid boosters: Who is being vaccinated?,
Ukraine conflict: What is Nato and how has it responded to Russia's invasion?,
Refugees in Wales: 'Thank God I came here after our home was bombed',
Bale hits back at Spanish media over 'parasite' criticism,
FA pledges 100 free buses for Liverpool v Man City semi-final at Wembley,
Italy out of World Cup: Can Azzurri turn 'disaster' against North Macedonia into better future?,
Women's Six Nations: Watch the best tries from the 2021 tournament,
Ukraine war: Five wounded after explosions hit western city of Lviv,
P&O Ferries: Protests at ports against sackings,
Taylor Hawkins: Foo Fighters' drummer dies aged 50,
Ukraine: Sadiq Khan says UK should do more to help refugees,
War in Ukraine: Musicians perform emotional concert in Kharkiv metro station,
England 2-1 Switzerland: Luke Shaw & Harry Kane goals help Three Lions earn Wembley win,
"China plane crash: All 132 passengers and crew dead, officials confirm",
Ukraine war: Oligarch Eugene Shvidler's jets held indefinitely,
Michael Bisping: Former UFC star looks back on remarkable career in new documentary,
Black man 'not dressed for climate' searched by Met police,
Dorset Police hunt prisoner on the run in underwear and socks,
Man found buried in garden died from stab wound to neck,
Sergio Perez on Saudi Arabia pole as Lewis Hamilton out early and Mick Schumacher crashes,
War in Ukraine: Change of emphasis or admission of failure by Moscow?,
Russian general Yakov Rezantsev killed in Ukraine,
Ukraine war: Ros Atkins on... Putin’s false ‘Nazi’ claims,
Tracking the Ukrainian counter-attacks in maps ,
Ukraine defence: Red lights and painted arrows fuel fear of Russian agents,
Civilian deaths: Aerial video shows escaping father killed in Ukraine,
Next stop Kyiv - the battle on the capital's outskirts,
"In pictures: Taylor Hawkins, a drummer who 'served the song'",
"1,000-year-old oaks used to create 'super forest'",
BBC Breakfast forced off air early by fire alarm,
Netflix's Diana the Musical named worst film by Razzie Awards,
Belfast: The real people and streets behind Branagh’s film,
Anime: How Japanese animation has taken the West by storm,
Hazara: The female karate champions 'breaking out of the cage',
Week in pictures: 19 - 25 March 2022,
John Lennon's son opens Yoko Ono performance centre in Liverpool,
Will Ukraine invasion push Japan to go nuclear?,
Celebration as the Oscars ceremony returns to Hollywood,
"'Fraudsters stole everything, even my house'",
Oscars 2022: Could Apple's Coda win best picture?,
Covid-19 in the UK: How many coronavirus cases are there in my area?,
"On the road to Mariupol, a southern Ukrainian town fears for the worst",
Solar farms: Can expansion overcome Tory MPs' concerns?,
Ethiopia's civil war: The women who paid the price,
England coach Middleton 'frustrated' despite big win over Scotland in Women's Six Nations opener,
Republic of Ireland earn friendly draw with Belgium,
Women's Six Nations: Abby Dow scores bonus-point try for England against Scotland,
Women's World Cup: Suzie Bates gets standing ovation as she hits 126 for New Zealand,
Women's Six Nations: Hannah Jones scores 'breathtaking' try for Wales against Ireland,
"Ukraine: No Russia regime change plans, says Blinken",
Shanghai Covid: China announces largest city-wide lockdown,
Oscars 2022: Hollywood gears up for its biggest night,
Ferry firms to meet officials over P&O fallout,
Gruinard Island: Fire on island used for Anthrax experiments,
El Salvador: State of emergency after 62 gang killings in a day,
Bethnal Green: Murder arrest over stabbed mother-of-two,
Afghanistan: Taliban bars BBC TV programmes from schedules,
Dorset prisoner on run in underwear 'changes appearance',
The Apprentice winner Harpreet Kaur: Sometimes I don't realise how direct I am,
Verstappen wins GP after late overtake,
Oscars: Branagh and Hinds to attend after Covid all-clear,
Snowdonia: Walker critically ill after cliff fall,
"Ukraine war is our war, say Brit ex-squaddies heading to Lviv",
Why Biden's off-script remarks about Putin are so dangerous,
Russia transfers thousands of Mariupol civilians to its territory,
Ukraine war: The drone pilots monitoring Russian troops,
Why has Russia invaded Ukraine and what does Putin want?,
Tracking the Ukrainian counter-attacks in maps ,
SS Central America: Haunting photos recovered the 'ship of gold' wreck on ocean floor,
Oscars: 'It's been a hell of a ride' - Jude Hill's Belfast journey,
Max Woosey: Carol Vorderman in campsite singalong for charity,
Your pictures on the theme of 'into the blue',
Baby goats and gardens to help with hospital stress,
Marble Ass: The pioneering LGBT film made during the Balkans war,
'Everybody should be allowed to play football',
Malmo stabbing prompts soul-searching in Sweden,
Electric cars: Five big questions answered,
Ukraine war: Chernobyl’s vodka producer remains defiant,
When K-pop met India: The Indian artists collaborating with Korean stars,
The Palestinian cancer centre that can't take patients,
England suffer 10-wicket defeat by West Indies in third Test - and lose series 1-0,
Chelsea thrash Leicester 9-0 to go top of WSL,
England always believed they could revive World Cup campaign - Dunkley,
'Women's football won' - Man Utd boss and fans savour historic day for team,
Huddersfield escape Cup scare at Barrow - highlights & report,
Josh Warrington knocks out Kiko Martinez to regain IBF featherweight title - highlights,
Women's Six Nations: Emilie Boulard scores brilliant try for France against Italy,
Roman Abramovich suffered suspected poisoning at talks,
"Partygate: Met Police to issue first fines, sources say",
Oscars condemns Will Smith slap and launches review,
Ros Atkins on… the UK’s rising Covid infections,
Children in critical condition after dog attacks,
P&O: Second ferry detained over safety concerns,
School-run mum admits climate protest drive charge,
Cadbury shrinks size of Dairy Milk sharing bar,
Boris Becker reveals shock and embarrassment over bankruptcy,
Batley man jailed for son's murder 21 years after attack,
"Brothers, 12 and 13, wanted for raiding top London hotels",
Knoydart community owns Britain's remotest mainland pub,
Northampton friends make a cuppa after £1m lottery win,
Roman Abramovich: From orphan to sanctioned billionaire oligarch,
Boris Nemtsov: Murdered Putin rival 'tailed' by agent linked to FSB hit squad,
War in Ukraine: Anti-war Russians intimidated on their doorsteps,
What is a war crime and could Putin be prosecuted over Ukraine?,
Ukraine: Premature babies struggling for life in bombed cities,
Russia transfers thousands of Mariupol civilians to its territory,
"In Chernihiv, civilians are trapped as hospitals and schools attacked",
Russian oligarchs: Where do they hide their 'dark money'?,
"Russian agent linked to assassination team was tracking Boris Nemtsov, investigation finds",
Stockport couple's lost engagement ring found by metal detectorist,
The Lord Bishop John Sentamu remembers Prince Philip,
Sale of Banksy anti-war artwork raises funds for Kyiv hospital,
The Full Monty to return as eight-part Disney+ TV series,
First England women's football captain honoured with plaque,
Covid-19 in the UK: How many coronavirus cases are there in my area?,
Can the super-rich solve America's budget problem?,
Hebrides: Life on beautiful islands with the UK's worst fuel poverty,
What are the UK's remaining Covid restrictions?,
China: How is its zero-Covid strategy changing?,
Alzheimer's: Neil Kinnock supporting wife through disease,
Beatings and forced abortions: Life in a North Korea prison,
Beating noise pollution with smart tech,
'Commercial' Man Utd may not suit Ten Hag - Van Gaal,
Medvedev moves closer to top ranking with win over Martinez,
'Harder to win Euros than World Cup' - Players excited by 'unbelievable' tournament,
Salisbury to become third Briton to reach world number one,
Bernal back on bike two months after life-threatening crash,
Canada reach World Cup: John Herdman - the English manager behind landmark qualification,
What is the background to Will Smith's attack?,
Watch the moment Will Smith hit Chris Rock,
How the feel-good film Coda caused an Oscars upset,
Oscars fashion: Red carpet in pictures,
All the winners and nominees,
Oscars 2022: Timothée Chalamet and Zendaya were just two of the stars on the red carpet,
UK elections 2022: A really simple guide,
UK elections 2022: Is there an election in my area?,
England local elections 2022: What's at stake for the parties?,
NI election 2022: Why Northern Ireland's election is different,
Scotland elections 2022: Five things to watch in May's council vote,
Queen attends Prince Philip memorial service at Westminster Abbey,
Shrewsbury and Telford Trust: Better care might have saved 201 babies,
Twenty fines to be issued over No 10 lockdown parties,
Jada Pinkett Smith breaks silence on Oscars slap,
Rules on free lateral flow and PCR Covid tests published,
Handforth Parish Council: Jackie Weaver 'did not have the authority',
Rise of TikTots - under-age kids on social media,
Covid: Free parking for NHS hospital staff in England to end this week,
Five killed in latest deadly attack in Israel,
Ukraine war: Dozens of Russian diplomats expelled by four EU nations,
Six month warning over £20 and £50 paper notes,
Former F1 boss Max Mosley shot himself after terminal cancer diagnosis,
Boris Becker trial hears star lost Wimbledon trophies,
Ukraine war: Odesa defies Russia and embraces signs of life,
Ukraine war: Bringing up a baby among the bombs,
Does video show Russian prisoners being shot?,
Ukraine peace talks: The West calls for actions not words from Russia,
Why the Red Cross has to be neutral in the Ukraine conflict,
Your daily Ukraine round-up,
In pictures: Queen joins royals for Prince Philip's memorial service,
Queen thanks DofE winner Doyin Sonibare after Prince Philip thanksgiving speech,
Ukraine: Sheltering with monks in a Romanian monastery,
Kev Crane: Singing plumber signs Hollywood film deal,
Shane Warne: Australians reflect on cricket legend and 'man of the people',
Knoydart community owns Britain's remotest mainland pub,
João Carvalhaes: Football's psychology pioneer and his role in 1958 World Cup win,
Oscars: What Will Smith's slap says about him - and us,
Relief as Queen makes it to the abbey for memorial,
Biodiversity: What is it and how are we protecting it?,
Amazon union election: Will this former worker make history?,
Ukraine crisis: Why India is buying more Russian oil,
French election: Why the small town of Moissac is on edge,
Can tech help you to manage the cost of living?,
England 3-0 Ivory Coast: Raheem Sterling scores as Three Lions cruise to win,
Mane sends Senegal to Qatar in shootout after Salah misses,
Portugal 2-0 North Macedonia: Bruno Fernandes sends Portugal to World Cup,
Ex-speed skater Christie set for new e-scooter series,
"Miami Open: Cameron Norrie loses to Casper Ruud, Daniil Medvedev wins",
Transgender cyclist Bridges set to race in first women's event,
Election 2022: Is there an election in my area?,
Shrewsbury maternity deaths scandal will spark change - Javid,
Ukraine War: Putin demands Mariupol surrender to end shelling,
Germany and Austria take step towards gas rationing,
Tom Parker: The Wanted singer dies aged 33,
Boris Johnson must resign over lawbreaking at No 10 - Starmer,
Emily Bridges: Transgender cyclist will not race in women's National Omnium event,
Bruce Willis gives up acting due to brain disorder aphasia,
Jamie Wallis MP comes out as trans and speaks of rape ordeal,
Grenfell Tower: Official admits he could have prevented fire,
"Worcestershire dog attack: Boy, two, dies in hospital",
Ukraine conflict: Russia to allow unauthorised imports from West,
End of Scottish face mask rules delayed until Easter,
Brexit delayed pandemic plans says disaster expert,
Ukraine war: The Syrians signing up to fight for Russia,
Ukraine round-up: Little progress in peace talks as shelling continues,
The Ukrainian woman shot by Russian soldiers on the front line,
Does video show Russian prisoners being shot?,
Concert For Ukraine: Refugees' stories centre stage at £12m charity show,
Alopecia: 'I'm ditching my wig in public after Oscars row',
Australia floods: Severe flooding strikes Australian east coast again,
Shane Warne: Sir Elton John and Ed Sheeran lead tributes at emotional memorial,
Ronin Network: What a $600m hack says about the state of crypto,
Dog saved by Ukrainian soldiers from abandoned home,
Dyson headphones come with air vacuum for mouth,
Tipu Sultan: Painting of British defeat in India sold at auction,
Rise of the five-year-old 'TikTots',
Endometriosis: A hidden disease affecting one in 10 women,
Ukraine war: Youngsters in Finland worried conflict could spread,
Fast fashion: European Union reveals fast fashion crackdown,
Shropshire baby deaths: The parents whose lives were changed forever,
Is Prince Andrew trying to return to public life?,
"Ukraine: 'I am safe, my daughter is safe, that's the main thing'",
Tom Parker's life in pictures,
Ukraine war: What next for the African students who fled?,
'We see the queue for food growing day by day',
Nou Camp: 'Magical' night for women's football as crowd record broken,
Paris St-Germain Féminines 2-2 FC Bayern München Ladies (4-3 agg): Ramona Bachmann scores winner in extra time,
Women's World Cup: Australia's Beth Mooney takes 'remarkable' diving catch,
Roman Abramovich sanctions: Chelsea can't be 'business as usual' - Nigel Huddleston,
Women's World Cup: England set to face South Africa in semi-final,
Paris St-Germain president Nasser Al-Khelaifi on European Super League & FFP,
Barcelona Femenino 5-2 Real Madrid Femenino (8-3 agg): Hosts win in front of record crowd,
Putin sets midnight deadline over rouble gas payments,
"Ukraine war: Russian troops leave Chernobyl, Ukraine says",
Ukraine war: Russian forces regrouping for attack - Nato,
Conversion therapy: Ban to go-ahead but not cover trans people,
"I know how Will Smith felt about his wife being criticised, says Rishi Sunak",
Energy websites crash in meter readings rush,
Ex-hostage recounts ordeal at trial of Islamic State jihadist,
UK weather: Spring snow as parts of country hit by cold snap,
Lincoln City to silence Dambusters March and air raid sirens due to Ukraine war,
Rotherham: Grooming gang detective cleared of misconduct,
French intelligence chief Vidaud fired over Russian war failings,
Grenfell Tower inquiry: Ex-minister denies not prioritising safety,
Sheffield Leadmill faces closure after eviction notice,
Ukraine war: Cars appear to drive around landmines placed in road near Kyiv,
Could Ukraine 'win' the war? And other questions,
Ukraine round-up: Russia sets gas deadline for West and troops leave Chernobyl,
How do you do a face-to-face interview with Zelensky?,
"Ukraine war: Russia blocks buses heading to Mariupol, says Ukraine",
Ukraine war: Mariupol's refugees carry wounds of battered city,
Liz Truss visits India on same day as Sergei Lavrov,
Why has Russia invaded Ukraine and what does Putin want?,
Kevin Lee: The Briton who plays the bad guy in China's patriotic movies,
Gareth Bale's golf-themed bar: Opposition mounts to Bristol bar planned,
War in Ukraine: President Zelensky addresses Australian parliament,
Nigerian student's search for a new university after fleeing Ukraine,
New women's football crowd record set at Nou Camp,
"African frog found in bag of mint after 5,800-mile trip",
Ghazipur fire: Gasping for air as massive Delhi landfill burns,
The UK video games market is worth a record £7.16bn,
Shrewsbury maternity scandal: The mothers who died,
Covid: Why are so many people catching it again?,
Why are energy bills so high and when should I take a meter reading?,
Are we entering a 'golden age' for trade unions?,
Ukraine war: How reliant is the world on Russia for oil and gas?,
Alopecia: 'So much of black beauty is derived from your hair',
'We need more school governors who look like me',
Pakistan's Imran Khan is fighting for his political life,
Pub chain warns of higher food prices as VAT rises,
Wolfsburg 2-0 Arsenal (agg: 3-1): London side knocked out at quarter-final stage,
Fifa World Cup Qatar 2022: Everything you need to know about Friday's draw,
Yorkshire: Structural reforms approved at EGM allowing club to host England matches,
Women's World Cup: England reach final thanks to Wyatt's 129 & Ecclestone's six wickets,
Premier League clubs agree to five substitutes from 2022-23 season,
"Qatar World Cup 2022: Criticism 'ill-informed', says tournament chief Hassan Al-Thawadi",
Super League: Wigan Warriors 19-18 Hull FC - Late Harry Smith drop-goal gives hosts win,
Warning of fresh energy bill shock in October as prices rise again,
Covid: Record 4.9 million people have the virus in UK,
Infosys: Tech firm part-owned by Chancellor Rishi Sunak's wife closing Russia office,
Ghislaine Maxwell bid for retrial denied,
Researchers in Hong Kong create 'soft robot' made of magnetic slime,
Emily Bridges: Transgender cyclist still seeks clarity on 'alleged ineligibility',
Fifa World Cup Qatar 2022: England could face Scotland or Wales in group stage,
Prince Andrew repays cash amid financial dispute,
Concerns over handling of fines for Covid breaches,
Sri Lanka imposes state of emergency amid protests,
Amazon workers win battle to form first US union,
"Ukraine war to halve global trade growth, warns WTO",
Bruce Willis: Razzies cancel 'worst performance' award over health issues,
Battle for Irpin: Russian forces pushed out of Kyiv suburb,
Why Russia is trying to encircle Ukraine's east,
Ukraine round-up: Possible war crimes and an attack on Russia,
"Quiz of the week: Oscars fashion, superyacht and Dyson's new gizmo",
Derby driver crashes new Ferrari straight after buying it,
In pictures: Behind the shop facade,
Queen's life at Balmoral celebrated in exhibition,
We hid in the cellar as the Falklands were invaded,
World Cup 2022: How has Qatar treated stadium workers?,
Fifa World Cup Qatar 2022: What are the draw highlights?,
Immensa: Why were Covid test errors at Wolverhampton lab not stopped sooner?,
UK farmers call for weedkiller ban over Parkinson’s fears,
Chip shortage: Has Europe's plan arrived too late?,
China: Peeking into the private lives of livestreamers,
Cricket World Cup: England-Australia final to be shown free to air on Sunday,
"Declan Rice: West Ham and England midfielder worth more than £150m, says boss David Moyes",
United Rugby Championship: Sharks 51-3 Dragons,
Liverpool boss Jurgen Klopp says planning for FA Cup semi-final 'ridiculous',
Fifa World Cup Qatar 2022: Day-by-day guide to fixtures,
Gareth Southgate assesses England's World Cup group,
World Cup 2022: Relive 10 defining goals from 2018 tournament,
How we pay the bills: Skipping meals and fewer car journeys,
What is the UK's inflation rate and why is the cost of living going up?,
Who allowed the energy price cap to rise so much? And other questions,
Five reasons why prices and bills are going up,
Martin Lewis: ‘We need political intervention on cost of living’,
What is the minimum wage and how much is it?,
Energy price cap rise: 'I've taken a second job',
Money saving tips: How to cut spending as energy bills rise,
War in Ukraine: Street in Bucha found strewn with dead bodies,
Dover queues due to shortage of cross-Channel ferries,
Manchester Airport: More delays blamed on lack of staff,
Tory MP David Warburton suspended during investigation into claims,
War in Ukraine: Johnson congratulates Volodymyr Zelensky over Kyiv push back,
Essex Police make 83 arrests as oil terminals blocked,
Princess Beatrice 'wedding gift' claim in court case,
"Plane crashes into block of flats near Bicester, Oxfordshire",
Train driver left with bloodied face after brick attack,
Hargeisa fire: Inferno devastates market in Somaliland's capital,
Search under way in English Channel for missing small plane,
Three Palestinian militants killed by Israeli forces in West Bank clash,
Cricket World Cup: England and Australia set for final,
The heavy losses of an elite Russian regiment in Ukraine,
Ukraine: Why the cartoon Masyanya was banned in Russia,
Russia's war ignites Orban's tightest election challenge in Hungary,
Prince Charles gets chivalrous on EastEnders set,
Lateral flow tests: Should I recycle the plastic?,
Referee Mike Dean on '22 years at top',
One mother's mission to ban 'vulgar' books,
Naga in fits of laughter at Charlie's Mars musings,
Week in pictures: 26 March - 1 April 2022,
The Papers: Covid-19 infection rates reach 'all time high',
Will Smith: Can his career recover after Oscars slap?,
We hid in the cellar as the Falklands were invaded,
'I've had long Covid for two years now',
Cricket World Cup: Kate Cross & Amy Jones set for final after missing 2017,
Shrewsbury maternity report: Uncovering the biggest NHS maternity scandal,
Covid-19 in the UK: How many coronavirus cases are there in my area?,
Man City v Liverpool: 'We will fight' - title race intensifies as rival bosses focus on big match,
Christian Eriksen: Midfield maestro thriving again at Brentford,
