title,
"Garth Crooks' Team of the Week: Ronaldo, Diaz, Eriksen, Yarmolenko, Rudiger",
Matt Dawson column: England’s Ireland loss is gold dust for World Cup,
Women's World Cup: Watch bizarre Nat Sciver dismissal for England against South Africa,
MOTD2 analysis: Could Patrick Bamford be the difference for Leeds United?,
Ukraine war: Editor interrupts Russian TV news show,
Homes for Ukraine refugee scheme launches in UK,
Ukraine war: West made 'terrible mistake' after Crimea - PM,
Roman Abramovich: New evidence highlights corrupt deals,
NHS struggling with 'long tail' of pandemic mental ill health,
Ukraine war: Pub dedicated to Hemingway destroyed in Kharkiv,
Scotland's decision day for easing final Covid rules,
Russia-Ukraine war: British Fox News journalist injured,
Putin changes law on leased jets to keep them flying,
Ukraine: Eight arrests at oligarch's London mansion after balcony protest,
China: Businesses shut as officials widen Covid lockdowns,
Outdoor civil weddings and partnerships here to stay,
Cheltenham Festival 2022: What to watch out for at four-day meeting,
Ukraine war: A baby born under bombardment in Bucha,
"Ukraine war: Kyiv terrain will slow Russian troops, say Ukraine generals",
How to sponsor Ukrainian refugees and offer them a UK home,
War in Ukraine: What happened on day 19 of Russia's invasion,
Mass graves in Ukraine: Battered cities are digging makeshift burial sites,
WATCH: Residents rescued after Kyiv apartment block strike,
Ukraine war: Drone shots show Mariupol devastated by fighting,
Newspaper headlines: 'Rush to take in Ukrainians' and 'you're Putin us up mate',
March 4 Justice: Has anything changed for Australian women?,
Science and tech: The app founder inspiring kids,
How barista training opens doors for refugees,
'Double tap' attacks in Yemen's civil war,
Baftas 2022: Encanto director takes glasses campaigner to London ceremony,
Hamilton to change name to include mother's surname,
"Inflation: Sports bras in, doughnuts out of cost of living measure",
Northern Lights: Powerful aurora borealis display above Scotland,
Ukraine war: Silent streets in wiped out Donetsk town,
Behind the scenes on the nearly-ready Crossrail project,
The popular apps aiming to tame the chaos of family life,
Ukraine war: Fears Russian aggression could spill into Poland,
Covid: Generation of musicians 'devastated' by restrictions,
War in Ukraine: Why Vladimir Putin couldn't have trained fighters in Africa,
Ukraine conflict: What military and economic support could China offer Russia?,
Chelsea & Roman Abramovich: Is this a moment of reckoning for English football ownership?,
Cancer: 'I thought I had Covid but it was terminal lung cancer',
How many refugees have fled Ukraine and where are they going?,
Australian Smith holds off England's Casey to win Players Championship and $3.6m,
"Better to be in our position than Liverpool's, says Man City's Silva",
Nadal beats GB's Evans at Indian Wells to continue unbeaten run,
Celtic ease by Dundee Utd into Scottish Cup last four,
Palace hold wasteful Man City to draw,
Women's World Cup: Perry & Gardner star as clinical Australia beat Windies,
Ukraine war: European leaders risk train ride to meet Zelensky,
Boris Johnson to visit Saudi Arabia in bid to ditch Russian oil,
Ukraine war: Two women in Kyiv tower blocks record their new life under siege,
The Western brands unable to leave Russia,
Met Police apologises for strip-search of Hackney schoolgirl,
"New Zealand border to reopen from next month, PM Ardern says",
The tragedy of Afghanistan's malnourished children,
"Nazanin Zaghari-Ratcliffe has UK passport returned, MP says",
Church of England pressures TotalEnergies over Russia business,
"North Korea fires missile but launch fails, says South",
Heathrow Airport drops Covid face mask rules,
Royal Society of Chemistry report says racism 'pervasive',
Government overseen years of decline in NHS - MPs,
Pregnant women should be asked how much they drink,
Ukraine: Putin will search for a way to save face,
Ukraine's wartime rail chief has to be faster than the Russians tracking him,
War in Ukraine: What happened on day 20 of Russia's invasion,
Ukraine war: Could Russia use tactical nuclear weapons?,
Nigerian volunteer: 'Fighting in Ukraine is better than living here',
Ukraine war: Infection and hunger as hundreds hide in Mariupol cellar,
Ukraine UK refugee hosting scheme: Mum-of-four opens home to refugees,
Ukraine war: Protester exposes cracks in Kremlin's war message,
Ukraine war: One shell that destroyed a family,
What sanctions are being imposed on Russia over Ukraine invasion?,
Newspaper headlines: Zelensky's 'Nato concession' as Putin 'turns to Plan C',
Ukraine: The volunteers racing aid from the UK to the front line,
Stormzy tour review: Star praises fans who waited two years to see him,
Ukraine refugees: Bringing my mother to the UK,
Marina Ovsyannikova: TV protest 'was my own decision',
NYC's Met opera house hosts concert in support of Ukraine,
"Watkins, Duran & defensive errors - Emery's four tactical dilemmas",
When Alistair Brownlee helped brother Jonny over finish line,
CCTV shows Harshita Brella and husband near lake,
Son of IRA murder victim calls Disney drama 'horrendous',
Police warn against road travel during Storm Bert,
'Being stalked was worse than being held at gunpoint',
Putin says Russia will use new missile again in 'combat conditions',
Woman wins civil rape case against Conor McGregor,
Parents 'devastated' over British woman's death in suspected Laos poisoning,
Two detained over Gatwick Airport 'suspect package',
"Storm Bert heads to UK with heavy rain, wind and snow",
King accepts flowers for Queen who misses Royal Variety over illness,
Farming tax row - BBC Verify on which figures are more reliable and why,
People smugglers who promoted Tripadvisor-style video reviews convicted,
Spain fines budget airlines $179m and wants ban on hand luggage charges,
Trump nominates Scott Bessent to lead US Treasury,
EasyJet passengers film Iceland volcano lava from above,
No 10 indicates Netanyahu faces arrest if he enters UK,
Charged £720 to have a key cut - soaring bills drive leaseholders to breaking point,
What is methanol and how does it affect the body?,
The Papers: 'Business blames budget' and 'UK economy takes hit',
"The rise of Pam Bondi,  longtime Trump ally who is new  pick for attorney general",
Everything we know about Russia's Oreshnik missile,
Will China step up if Trump takes a step back on climate change?,
BBC visits mpox clinic as WHO says DR Congo cases 'plateauing',
"Jailed cancer charity thief ordered to pay back rest of £95,000 she defrauded",
Allison Pearson says she felt 'bullied' in police probe,
COP29 overruns as poor countries seethe over climate cash,
Dutch police find gnome made of MDMA during drug bust,
Gordon Brown declares opposition to assisted dying,
Family say Harshita Brella will not be forgotten,
"Sara Sharif’s dad is in eternal hell, jury told",
"The Week: Ukraine, Israel and John Prescott reflections",
'Dreamer' Amorim 'right guy' to revive Man Utd,
'I will be here' - Guardiola's relegation promise to Man City,
World champions South Africa lie in wait for Wales ,
I want England to be brave with the ball - Borthwick,
Vardy best England striker of his generation - Maresca,
'Chaos for Australia!' Hosts collapse to 67-7 against India,
Bomb disposal unit at bus station after 'alert',
Woman wins civil rape case against Conor McGregor,
Storm Bert amber snow warning extended in Scotland,
'Gutted for the girls' as claims grow against football star ,
"No 'red lines' in Ukraine support, French foreign minister tells BBC",
Man dies after tree falls on car as Storm Bert sweeps UK,
'Refused service yet again with my guide dog - I'm done speaking out',
Your pictures of Storm Bert from around the UK,
'Are we not humans?': Anger in Beirut as massive Israeli strike kills 20,
Murray to coach Djokovic at Australian Open,
"'Trust and reserve judgement' on rebrand, says Jaguar after backlash",
Mystery drones seen over three US air bases in UK,
UK wants to hire EU negotiator to 'reset' relations,
Kayaker's leg amputated in middle of river after 20-hour rescue,
Israel investigates as Hamas says female hostage killed,
China's huge sinkholes reveal hidden treasures as viral videos draw tourists,
The Papers: 'Two thirds back assisted dying' and 'Putin ready to cripple Britain',
A toxic staffing row is splitting the NHS,
Free shots and beer buckets in party town at centre of suspected methanol deaths,
Will Rachel Reeves' difficult week cause her lasting damage?,
"Lava, letters and a loch: Photos of the week",
"I am going to be proud one day, says teen after struggle with mental health system",
Watch: Snowy Saturday as Storm Bert sweeps the UK,
Murder arrest after man shot dead in Birmingham,
Flat caps galore at Tommy Shelby lookalike contest,
Irish justice minister praises 'bravery' of woman in Conor McGregor rape case,
Kate Nash says her OnlyFans will earn more than her tour,
John the cat gets stuck in drainpipe,
The Assisted Dying Debate: Ex-PM Gordon Brown Intervenes,
'In eight years we never lived like this' - what is wrong at Man City?,
Wales coach Gatland to learn fate in coming days,
Why 'extra special' Nwaneri has to remain patient,
"'Time for Scotland to deliver result, not moments'",
Kane scores hat-trick to break Bundesliga record,
Murray to coach Djokovic at Australian Open,
Murder arrest after man shot dead in Birmingham,
Homes flooded and travel disrupted by Storm Bert,
Flood fears as Storm Bert heads into second day,
Storm Bert brings landslide and 82mph gusts,
"Storm Bert floods 'absolutely devastating', says Welsh FM",
'Don't drink the spirits': Laos backpackers avoid shots after suspected poisonings,
British man captured while fighting with Ukraine,
"Young people who refuse to work to lose benefits, says minister",
"In stifled sobs and fierce accusations, family falls apart at mass rape trial",
Expelled the same day: Ireland hardens illegal immigration response,
Adele doesn't know when she'll perform again after tearful Vegas goodbye,
Huge deal struck but is it enough? 5 takeaways from a dramatic COP29,
Irish prime minister apologises for walking away from care worker,
Wicked opening set to be biggest for Broadway film,
'I can't say what my face will do in two hours',
"Feel free to sing in the cinema, says The Rock",
'Refused service yet again with my guide dog - I'm done speaking out',
Your pictures on the theme of 'autumn walks' ,
'We knew Christmas before you' - the Band Aid fallout ,
"Martin Lewis meets deepfake scam victim who lost £76,000",
Burning old TVs to survive: The toxic trade in electrical waste,
Perfume boss captured on video admitting he ignored Russia sanctions,
India's 'rebel' Muslim princess who shot tigers and drove a Rolls-Royce,
Lauren Laverne given 'all clear' following cancer diagnosis,
"Huge COP29 climate deal too little too late, poorer nations say",
Dozens killed in Pakistan sectarian violence,
South Korean man dodged draft by binge eating,
"Assisted dying bill about right to choose, says minister",
"Rabbi who went missing in UAE was murdered, Israel says",
Verstappen wins title as Russell triumphs in Vegas,
"Will Labour’s Plan For Work, Work?",
'Now give Mo his dough' - Liverpool can't let Salah leave Anfield,
'We will suffer for a long period' - why there is no quick fix at Man Utd,
England are in a very good place - George,
Why Verstappen's 'almost flawless' season is 'towering achievement',
Humphries beats Littler to win Players Championship,
Why Leicester acted quickly to end Cooper reign,
Scotland 'found a way to win' against Australia,
Storm Bert causes widespread rail disruption,
Clean up begins after Storm Bert floods,
Queensferry Crossing ice closure a 'safety first' decision,
Anger as Storm Bert leaves trail of destruction,
Two Britons among 16 missing after Red Sea tourist boat sinks,
More rain forecast after Storm Bert hits UK ,
Emergency crews tackle flood waters in rescue operations,
Judge dismisses special counsel's election case against Trump,
Reeves tells firms no more tax rises as she defends Budget,
Gangsters block aid distribution in south Gaza,
Man arrested after eight-year-old girl shot in car,
"I'm not surprised some voters want election re-run, says Starmer after petition",
Prosecutors demand 20-year jail sentence for husband in mass rape trial,
"Israel and Lebanon close to ceasefire deal, Israeli officials say",
"I had good intentions, says Letby safeguarding boss who failed to raise concerns",
"We were ready to leave climate summit, negotiator tells BBC",
Barbara Taylor Bradford: An author of substance,
"The Papers:  'No more tax rises, insists Reeves' and 'PM in jobs push'",
‘I had no idea being a social drinker would damage my liver by 31’,
Menendez brothers' resentencing hearing delayed until January,
How service charges in flats spiralled out of control,
Elton John album on hold because he 'can't see',
"People should intervene if they see women at risk of spiking, minister urges",
Malaysia government told to return seized LGBT watches,
£1.25 a night Welsh tourism tax may start in 2027,
Angela Merkel defends ties with Russia and blocking Ukraine from Nato,
Davina McCall says 'it's nice to be home' after brain surgery,
Trump's 'border tsar' vows to cut funding to 'sanctuary' states,
Pakistan police clash with Imran Khan supporters heading to Islamabad,
"Reeves My Lips, No New Taxes (On Business)",
Angela Merkel on Putin’s dog and Trump’s handshake,
Bethell to bat at three on England Test debut,
Root 'a rung below' Smith and Kohli - Lehmann,
General Motors agrees deal to enter F1 in 2026,
'A huge result' - could West Ham win at Newcastle be turning point for Lopetegui?,
'As open as it has ever been' - is this the tightest Premier League?,
Salah selfish for contract comments - Carragher,
Man admits murdering 'defenceless' woman in front of friends,
Parents question 'flawed' Garda canal death probe,
Supreme Court to hear case on definition of a woman,
Rugby club devastated by Storm Bert had no insurance,
What we know about Israel-Hezbollah ceasefire deal,
"Israel-Hezbollah ceasefire designed to be permanent, says Biden",
Israeli anger at 'irresponsible and hasty' ceasefire,
Questions over Hezbollah's future after ceasefire,
"CCTV shows autistic pupils pushed, pinned to walls and sitting in vomit",
Mother of child hidden in drawer from birth jailed,
"Vauxhall owner to close Luton factory, putting 1,100 jobs at risk",
Five survivors found day after Red Sea tourist boat sinking,
MPs back plans for phased smoking ban,
'Hardest decision of my career': MPs wrestle with assisted dying choice,
UK winner of EuroMillions scoops £177m jackpot,
UK military join hunt for drones near US airbases,
One of the US's most wanted men arrested in Wales,
Storm Conall to bring more rain to parts of England and Wales,
"Harshita Brella's husband was arrested before, says police watchdog",
Trump proves he is serious on tariffs - but it's not about trade,
The Papers: Electric car 'chaos' and Israel-Hezbollah ceasefire,
Watch: How big is the problem of people not working?,
"What is Baller League? Why are KSI, Lineker & Terry involved?",
Russian deserter reveals war secrets of guarding nuclear base,
Mum's tribute to 'beautiful' daughter who died on M5,
Man arrested over tractor drive through floods,
No 10 denies Russian claims that expelled UK diplomat was a spy,
Sharp rise in bathing sites rated unfit for swimming,
New Mauritius PM has reservations about UK's Chagos deal,
Black Friday shoppers warned to be wary of deals,
Climbing inside a Kelpie's head ,
"Trump, tariffs and trade wars",
Angela Merkel on Putin’s dog and Trump’s handshake,
"'Fragile, frail & weak' - Man City's defensive woes continue",
Zhang makes maximum 147 break at UK Championship,
'We know what we're doing' - Stokes on Bethell,
Fans have a right to express how they feel - Guardiola reacts to boos,
"Rapper Slowthai raped women after gig, court told",
Remains exhumed from cemetery in Disappeared search,
Hospitals inquiry families say safety fears remain,
'I spent my wedding night gambling away our money',
Police investigate more people over Al Fayed abuse,
"Jeremy Bowen: The Lebanon ceasefire is a respite, not a solution for the Middle East",
Bomb threats made against Trump cabinet nominees,
Lucy Letby's dad 'made threats' in meetings with hospital CEO,
MPs to debate petition calling for another election,
Lyse Doucet: Nowhere else on Earth are so many children fleeing war,
"Liz Hatton, teen photographer who inspired Kate, dies aged 17",
Israel to appeal against ICC warrants for Netanyahu and Gallant,
Ex-PM David Cameron backs assisted dying bill ,
"Mum told partner 'I'm sick of you hitting me' before suicide, manslaughter trial hears",
Man arrested after secret filming of women shared on TikTok,
Fans fume over Jason Donovan Rocky Horror no-show,
Israelis survey damage and mull return to north as ceasefire begins,
Displaced Lebanese head for homes as fragile truce appears to hold,
What we know about Israel-Hezbollah deal,
The conflict in maps: Ceasefire in effect in Lebanon,
'You can't wipe out Billingsgate Fish Market overnight',
The Papers:  'Tories failed on migration' and 'cops target Al Fayed network',
Diver describes rescuing nephew from capsized Egypt boat ,
Why India's latest Sun mission finding is crucial for the world,
'I found out I lost my Vauxhall job on WhatsApp',
Protest arrests after seven detained over links to Kurdish rebel group PKK,
Missing hiker found alive after more than five weeks in wilderness,
Storm Conall brings more rain as it passes over UK,
Lib Dem leader Ed Davey in bid for Christmas No 1,
Watch highlights from Mishal Husain's career as she leaves BBC,
The Israel-Hezbollah Ceasefire,
Angela Merkel on Putin’s dog and Trump’s handshake,
'Something special brewing at Slot's remarkable Liverpool',
Van Nistelrooy set to be appointed Leicester boss,
England punish sloppy South Africa to seal T20 series,
Relentless Liverpool beat Real Madrid in thriller,
"Rapper's friend raped woman at party, court hears",
Flights cancelled amid yellow weather warning,
Car speed limits could be cut but raised for HGVs,
Fears misinformation behind drop in contraception,
Gregg Wallace 'fascinated by my sex life and made lesbian jokes',
Kirsty Wark: Gregg Wallace used sexualised language and ‘people were uncomfortable’,
Starmer says migration 'off the scale' after record high last year,
"Hope, fear, faith and love: Four people on why assisted dying vote matters",
Transport secretary pleaded guilty to 2014 work phone incident,
Man who spied for Russia in UK 'discussed killing journalist',
Ceasefire largely holds but Israelis near Lebanon border have their doubts,
Families return to destruction in southern Lebanon,
Daniel Khalife was a British soldier who spied for Iran and dreamed of fame,
Putin threatens Kyiv decision-makers after striking energy grid,
All Scottish pensioners to get winter fuel payment,
"Baby remains were newborn girl, police say",
Assisted dying bill: What is in proposed law?,
'Hardest decision of my career': MPs wrestle with vote choice,
Last-minute lobbying ahead of major assisted dying vote,
How assisted dying has spread across the world and how laws differ,
"Israel building new military dividing line across Gaza, satellite images suggest",
How the Republic of Ireland will elect its next parliament,
'I sold my house to man on FBI's most wanted list',
Net migration numbers are down - how have the rules changed?,
Black Friday: How to spot a deal and not get ripped off,
"Missed opportunity to stop Lucy Letby, medical boss says",
Paris's Gothic jewel Notre-Dame to reopen five years after fire,
Romania orders election recount after TikTok bias claims,
Typhoo Tea falls into administration as sales slide,
Police given misconduct notices over girl's M5 death,
"Widow, 92, dines at castle each week for 37 years",
Jay Slater's family stop donations on fundraiser,
Starmer's Migration Mission,
The Assisted Dying Debate,
Amorim enjoys 'special' first Man Utd win despite 'anxiety',
Verstappen 'should start doing comedy' - Norris,
Lions deny Bears on Thanksgiving for 10th straight win,
'Missed opportunity' to stop Letby - medical boss,
Voters to take to the polls in Irish general election,
All Scottish pensioners to get winter fuel payment,
Price of tattoos 'will rise' as new safety rules begin,
MPs back bill to allow assisted dying after emotional debate,
Assisted dying bill: Find out how your MP voted,
"Gargoyles, stained glass and the spire: How Notre-Dame was restored",
Rupert Grint to pay £1.8m after losing tax battle,
"Millions to see mortgage costs rise, says Bank",
"'I watched porn morning, noon and night'",
Police hunt killer of young mother killed in e-bike hit and run,
"Tight three-way race in Irish general election, RTÉ exit poll suggests",
Syrian rebels take control in parts of Aleppo - reports,
Met Police apologises to honeytrap victims over email,
Man jailed for murdering brother-in-law in shooting spree,
Buckingham Palace curtains in your home for Christmas?,
"Chris Mason: A momentous day, whatever happens next",
Watch: The personal stories told in the Commons,
How the proposed law would work and who it would apply to,
Bill must pass many hurdles before it becomes law,
'It's part of my DNA': Charli XCX and the fight to save club culture,
Trump top spy pick faces fresh scrutiny over Syria visit and Russia comments,
Ukraine fights to keep the lights on as Russia hammers power plants,
Chris Mason: Louise Haigh's swift resignation prompts questions,
Weekly quiz: Which box office spell did Wicked break?,
'I got quick cash in my account but it was too good to be true',
Letby boss admits 'crass' letter to babies' families,
Mauritius asks for review of Chagos Islands deal with UK,
Janey Godley begins 'final tour' before funeral,
Van Nistelrooy named Leicester City manager,
Inside the £4m mansion Jurgen Klopp called home,
Gregg Wallace was 'fascinated by my sex life and made lesbian jokes',
MPs Vote in Favour of Assisted Dying,
The Trump Trials... Cases Closed?,
'Scots did not show best but can raise bar in Finland',
'Maybe it's destiny' - Amorim on Man Utd job & coaching philosophy,
What to expect from new Leicester boss Van Nistelrooy,
Hamilton says he is 'definitely not fast any more',
Ditcheva first British woman to win MMA world title as Loughnane beaten,
UK's first Dignitas widow feels ‘wonderful’ after assisted dying vote,
"Tight three-way race in Irish general election, RTÉ exit poll suggests",
Could police have handled Skye shooting differently?,
Angry doctors owed thousands refuse to work,
Syrian troops withdraw from Aleppo as rebels advance,
Who are the rebels seizing control of Syria's second city?,
Family 'desperate' as British couple still missing after Red Sea sinking,
'We voted for assisted dying bill - but still have concerns',
"Kate sends emotional Christmas message of 'love, not fear'",
"Irish election 'too close to call', says taoiseach",
Spain hotel check-in delay fears as new data rules begin,
World Beekeeping Awards axe honey prize due to fraud,
"'Rigorous' law firm to lead Gregg Wallace probe, say MasterChef producers",
"Under chandeliers, Lucy Letby hospital bosses broke their silence",
Georgia president calls for new elections as protests erupt again,
'I couldn’t stop watching': Personal stories of how porn obsession takes over lives,
Bushra Bibi led a protest to free Imran Khan - what happened next is a mystery,
Thousands visit site of Hassan Nasrallah's assassination ,
Are mystery drones above US bases in England something sinister?,
'It's part of my DNA': Charli XCX and the fight to save club culture,
Terminally ill people on both sides of assisted dying debate react to vote,
Why so many games are failing right now - and why others are breakout hits,
Janey Godley funeral is colourful comedy send-off,
Food charity pauses Gaza work after staff killed in Israeli strike,
"Woman's £1,906 bill over five-minute parking rule",
Cate Blanchett 'deeply concerned' by AI impact,
Man who found smooth Mars bar gets £2 compensation,
Tributes paid to Alex Salmond at cathedral service,
Lockdown DIY linked to landfill's noxious gases,
Newscast,
The Trump Trials... Cases Closed?,
'The impact of defeat is massive' - what to look out for in Liverpool v Man City,
'Title race on' - how Odegaard & Saka are keeping Arsenal hopes alive,
Russell promoted to Qatar pole by Verstappen grid penalty,
Wiegman vowed to experiment - did USA draw show 'evolution'?,
'No emotion' for Farrell in winning Irish send-off,
Could police have handled Skye shooting differently?,
'Pixelated' mural tackles stigma of breastfeeding,
Inside the £4m mansion Jurgen Klopp called home,
Families' 15-year wait for mine deaths inquest,
Gregg Wallace accusers criticise his response to allegations,
Bowen: Syria's rebel offensive is astonishing - but don't write off Assad,
"‘Italian’ purees likely to contain Chinese forced-labour tomatoes, BBC finds",
Georgia's PM hits back as protests and resignations intensify,
Former world snooker champion Griffiths dies aged 77,
'People want nothing to do with him': How Ireland turned away from Conor McGregor,
She fled Israeli bombing four times. It still found her,
British man killed on holiday in Turkey lift-shaft incident,
Losing your mind looking at memes? The dictionary has a word for that,
