title,
Man arrested on suspicion of rape at Groucho Club,
Majority of seats declared in close Irish general election,
Serie A footballer in intensive care after collapsing on pitch,
Elton John unable to 'watch own musical' after eyesight loss,
Belgium's sex workers get maternity leave and pensions under world-first law,
'They threw her body into the ocean' - woman dies on boat headed for French island,
Forgotten street found behind a hidden library door,
'I spent 30 years as a therapist to killers - and no-one is born evil',
Blind dates to find mates: Making friends with strangers over dinner,
"'Our estate pays £9,000 a year for grass to be cut'",
Global plastic talks collapse as oil states rebel,
Homes evacuated after sinkhole opens on estate,
Snoop Dogg helps Kai Cenat reclaim Twitch subscriber record,
Woman searching for birth parents found dad was a friend on Facebook,
Mother's 'terrible journey' to bedside of British woman poisoned in Laos,
Former My Chemical Romance drummer dies aged 44,
UN suspends aid deliveries through main Gaza crossing,
Newscast,
How Liverpool mixed best of Klopp & Slot to beat Man City,
Trump beats Hawkins to win second UK Championship crown,
Verstappen has 'lost all respect' for Russell,
Former world snooker champion Griffiths dies aged 77,
'I didn't expect that at Anfield' - Guardiola on 'sacked in the morning' chants,
Who has made Troy's Premier League team of the week?,
Fiorentina's Bove in intensive care after collapse on pitch,
Holidaymaker killed in Turkey lift-shaft incident,
Scotland's Budget must not cap council tax rises - Cosla,
Students upset by sea deaths help rescue migrants,
Final seats to be filled in Irish general election,
French government teeters after PM Barnier forces through budget,
Months of political instability loom as French government nears collapse,
Gregg Wallace apologises for 'any offence caused' by middle-class women comments,
Queen Camilla to miss start of Qatari state visit after chest infection,
Ukraine’s exhausted troops in Russia told to cling on and wait for Trump,
Fianna Fáil emerges as largest party in Irish election,
Vietnamese tycoon in race to raise $9bn to avoid execution,
Covid corruption commissioner starts fraud probe,
Tragedy chanting arrests at Liverpool v Man City ,
Israel strikes Lebanon as Hezbollah targets military post,
Starmer: UK does not need to choose between US and EU,
Georgia’s moment of truth: Protesters demand Western path not Russian past,
BBC hears of horror and hunger in rare visit to Darfur massacre town,
What is happening in north-western Syria and why now?,
'I thought kidney failure meant I'd never be a mum',
"I've been treated like dung, says oldest Post Office victim",
Jacob Rees-Mogg: Ex-politician says reality show a 'calculated risk',
Should you pay more for parking if you have a big car?,
Who is new Cabinet Secretary Chris Wormald?,
"Michelin chef 'gutted' at theft of 2,500 pies",
"Huge sinkhole is still growing, council leader warns",
"Small boat crossings hit 20,000 since Labour won election",
Man jailed for murdering girlfriend he set on fire,
Neighbours' Harold Bishop actor reveals he has terminal cancer,
Australian police seize $500m of cocaine after boat breaks down,
Gregg Wallace apologises for 'middle-class women' comment,
Americanswers… on 5 Live! Why has Joe Biden pardoned his son?,
Arsenal host holders Man Utd in FA Cup third round,
'It hurt I had to leave' - Van Nistelrooy reveals Man Utd pain,
Six Nations rebrand gets mixed reception from fans,
Dundee derby & Celtic v Kilmarnock in Scottish Cup ,
Sutton's predictions v The Slow Readers Club bassist James Ryan,
Morsy did not wear rainbow armband because of 'religious beliefs',
Life term for boy who shot mum dead through door,
NHS Grampian was warned of 'intolerable risk',
"Back budget or Wales could lose £1bn, FM warns",
"Teacher's pay rise simply impossible, says minister",
'Groping' and 'touching': Fresh claims against Gregg Wallace,
Why these Israeli men volunteered to fight - but now refuse to return to Gaza,
Analysis: Israeli and Hezbollah strikes test limits of ceasefire,
King hails Qatar's peace efforts - and banquet menu revealed,
'I worry every second': Mother of only British hostage in Gaza fears for her life,
Art showcasing Scottish Sikh community wins Turner Prize,
Killer in femicide that shocked Italy sentenced to life in jail,
'Pickling a cucumber changed my life' says TikTok award winner,
Three rail firms to be renationalised next year,
British band Sports Team robbed at gunpoint on US tour,
Thomas Kingston took life after reaction to medication,
Crowds celebrate as South Korean president withdraws troops,
'It feels like a coup d'état' - martial law chaos sparks worry in South Korea,
Watch: Protesters take to the streets outside parliament,
Why has this happened now?,
Why has an additive called Bovaer sparked controversy online?,
Sharon Stone’s tearful message to her younger self,
"AI won't replace humans making games, PlayStation boss says",
Watch: How Jaguar has shifted gears with its concept car,
"Inside Aleppo: Family reunions, nervousness at rebel rule and fear of war",
Why is vintage audio equipment booming?,
"Russian spies surveilled Ukrainian troops at US base, trial hears",
"Massive Elon Musk donation news to me, says Farage",
"Top chef's 2,500 pies 'a write off' after van theft",
Stalking victims to get right to know abuser's identity,
US woman admits drink-driving in crash that killed bride on wedding day,
Migrants brought to UK from remote military island,
"Letby was face of hospital campaign, inquiry told",
Martial Law in South Korea,
Who are the rebels threatening Assad's grip on Syria?,
Scotland's golden generation miss their golden hour,
Is Clinton pushing for England start at Euro 2025?,
FIA seeks rule changes after president allegations,
Highlights: Wales make history in Dublin,
Gang jailed over £200m of cocaine in banana boxes,
Scottish Budget presents huge challenges for SNP,
Celebrations as Wales make history qualifying for Euros,
School tells Muslim girls it’s ‘not safe’ for them,