title,Unnamed: 1,emotion
Michael Conlan reveals he is OK after Leigh Wood retains world title with brutal knockout,,neutral
"West Indies draw a huge step forward, says England captain Root",,neutral
How England's 14 men whipped up Twickenham crowd with stirring display,,neutral
'Salah must decide if he wants icon status - or money' - will Liverpool forward stay at Anfield?,,neutral
MOTD analysis: How 'sensational' Cristiano Ronaldo dominated Tottenham Hotspur,,neutral
Six Nations highlights: Ireland beat England to keep alive Six Nations hopes,,optimism
Ukraine crisis: US warns China against helping Russia,,neutral
Ukraine war: 21 children flown to UK for cancer treatment,,neutral
Bafta Film Awards: Benedict Cumberbatch's The Power of the Dog wins top prize,,neutral
William Hurt: Oscar-winning actor and Marvel star dies at 71,,neutral
Tom Brady: NFL great makes retirement U-turn after just six weeks,,neutral
Ukraine war: UK refugee scheme set to launch,,neutral
Brent Renaud: US journalist and filmmaker killed in Ukraine,,neutral
Hong Kong: Briton accused of jeopardising China's security,,neutral
"No-one raised security concerns over Lord Lebedev with me, says Michael Gove",,neutral
Irbil attack: Iran launches missiles at northern Iraqi city,,neutral
Chelsea 1-0 Newcastle United: Kai Havertz's late goal gives hosts three points,,neutral
Unions warn of job losses if rail firms close ticket offices,,neutral
Rod Stewart: Videos prompts pothole DIY repair warning,,neutral
Zhytomyr: Aerial attacks hit city that is corridor to Kyiv,,neutral
Ukraine war: Zelensky visits wounded Ukrainian soldiers,,neutral
How to spot false posts from Ukraine,,curiosity
Ukraine war: Five times refugees were met with kindness,,neutral
Poland feels the strain of Ukraine's refugees,,neutral
War in Ukraine: What happened on day 18 of Russia's invasion,,curiosity
Why I want to share my home with a Ukrainian refugee,,neutral
War in Ukraine: Uni to uniform - Ukraine's new teenage army recruits,,neutral
Newspaper headlines: 'War at Nato's door' as Putin has 'West in sights',,neutral
Baftas 2022: Seven highlights - from the jokes to the dresses,,neutral
The Syrian women replacing men as leaders,,neutral
Brent Renaud: Friend of US journalist killed in Ukraine speaks to BBC,,neutral
Northumberland farm welcomes five-legged lamb,,neutral
Reproductive coercion: 'I wasn't allowed to take my pill',,neutral
British food: How traditional firms are faring under pressure,,neutral
'I thought I had Covid but it was terminal lung cancer',,neutral
The innovative surfing tech making waves,,admiration
Deep listening: I realised we all share the same human feelings,,realization
Rosacea: 'Your skin doesn't define you',,neutral
The Muslim women learning to ride a bike in their 40s,,neutral
'No doubt I'll stay until end of season' - Tuchel pledges future as Chelsea taking things 'day by day',,neutral
'So emotional for me' - Ukraine's Yarmolenko scores as West Ham beat Aston Villa,,neutral
"Garth Crooks' Team of the Week: Ronaldo, Diaz, Eriksen, Yarmolenko, Rudiger",,neutral
Matt Dawson column: England’s Ireland loss is gold dust for World Cup,,neutral
Women's World Cup: Watch bizarre Nat Sciver dismissal for England against South Africa,,neutral
MOTD2 analysis: Could Patrick Bamford be the difference for Leeds United?,,curiosity
Ukraine war: Editor interrupts Russian TV news show,,neutral
Homes for Ukraine refugee scheme launches in UK,,neutral
Ukraine war: West made 'terrible mistake' after Crimea - PM,,neutral
Roman Abramovich: New evidence highlights corrupt deals,,neutral
NHS struggling with 'long tail' of pandemic mental ill health,,sadness
Ukraine war: Pub dedicated to Hemingway destroyed in Kharkiv,,neutral
Scotland's decision day for easing final Covid rules,,neutral
Russia-Ukraine war: British Fox News journalist injured,,sadness
Putin changes law on leased jets to keep them flying,,neutral
Ukraine: Eight arrests at oligarch's London mansion after balcony protest,,neutral
China: Businesses shut as officials widen Covid lockdowns,,neutral
Outdoor civil weddings and partnerships here to stay,,neutral
Cheltenham Festival 2022: What to watch out for at four-day meeting,,neutral
Ukraine war: A baby born under bombardment in Bucha,,neutral
"Ukraine war: Kyiv terrain will slow Russian troops, say Ukraine generals",,neutral
How to sponsor Ukrainian refugees and offer them a UK home,,curiosity
War in Ukraine: What happened on day 19 of Russia's invasion,,curiosity
Mass graves in Ukraine: Battered cities are digging makeshift burial sites,,neutral
WATCH: Residents rescued after Kyiv apartment block strike,,neutral
Ukraine war: Drone shots show Mariupol devastated by fighting,,neutral
Newspaper headlines: 'Rush to take in Ukrainians' and 'you're Putin us up mate',,neutral
March 4 Justice: Has anything changed for Australian women?,,curiosity
Science and tech: The app founder inspiring kids,,admiration
How barista training opens doors for refugees,,curiosity
'Double tap' attacks in Yemen's civil war,,neutral
Baftas 2022: Encanto director takes glasses campaigner to London ceremony,,neutral
Hamilton to change name to include mother's surname,,neutral
"Inflation: Sports bras in, doughnuts out of cost of living measure",,neutral
Northern Lights: Powerful aurora borealis display above Scotland,,neutral
Ukraine war: Silent streets in wiped out Donetsk town,,neutral
Behind the scenes on the nearly-ready Crossrail project,,neutral
The popular apps aiming to tame the chaos of family life,,neutral
Ukraine war: Fears Russian aggression could spill into Poland,,neutral
Covid: Generation of musicians 'devastated' by restrictions,,neutral
War in Ukraine: Why Vladimir Putin couldn't have trained fighters in Africa,,curiosity
Ukraine conflict: What military and economic support could China offer Russia?,,curiosity
Chelsea & Roman Abramovich: Is this a moment of reckoning for English football ownership?,,curiosity
Cancer: 'I thought I had Covid but it was terminal lung cancer',,neutral
How many refugees have fled Ukraine and where are they going?,,curiosity
Australian Smith holds off England's Casey to win Players Championship and $3.6m,,neutral
"Better to be in our position than Liverpool's, says Man City's Silva",,neutral
Nadal beats GB's Evans at Indian Wells to continue unbeaten run,,neutral
Celtic ease by Dundee Utd into Scottish Cup last four,,neutral
Palace hold wasteful Man City to draw,,neutral
Women's World Cup: Perry & Gardner star as clinical Australia beat Windies,,neutral
Ukraine war: European leaders risk train ride to meet Zelensky,,neutral
Boris Johnson to visit Saudi Arabia in bid to ditch Russian oil,,neutral
Ukraine war: Two women in Kyiv tower blocks record their new life under siege,,neutral
The Western brands unable to leave Russia,,neutral
Met Police apologises for strip-search of Hackney schoolgirl,,neutral
"New Zealand border to reopen from next month, PM Ardern says",,neutral
The tragedy of Afghanistan's malnourished children,,sadness
"Nazanin Zaghari-Ratcliffe has UK passport returned, MP says",,neutral
Church of England pressures TotalEnergies over Russia business,,neutral
"North Korea fires missile but launch fails, says South",,neutral
Heathrow Airport drops Covid face mask rules,,neutral
Royal Society of Chemistry report says racism 'pervasive',,neutral
Government overseen years of decline in NHS - MPs,,neutral
Pregnant women should be asked how much they drink,,neutral
Ukraine: Putin will search for a way to save face,,neutral
Ukraine's wartime rail chief has to be faster than the Russians tracking him,,neutral
War in Ukraine: What happened on day 20 of Russia's invasion,,curiosity
Ukraine war: Could Russia use tactical nuclear weapons?,,neutral
Nigerian volunteer: 'Fighting in Ukraine is better than living here',,neutral
Ukraine war: Infection and hunger as hundreds hide in Mariupol cellar,,neutral
Ukraine UK refugee hosting scheme: Mum-of-four opens home to refugees,,neutral
Ukraine war: Protester exposes cracks in Kremlin's war message,,neutral
Ukraine war: One shell that destroyed a family,,sadness
What sanctions are being imposed on Russia over Ukraine invasion?,,curiosity
Newspaper headlines: Zelensky's 'Nato concession' as Putin 'turns to Plan C',,neutral
Ukraine: The volunteers racing aid from the UK to the front line,,neutral
Stormzy tour review: Star praises fans who waited two years to see him,,neutral
Ukraine refugees: Bringing my mother to the UK,,neutral
Marina Ovsyannikova: TV protest 'was my own decision',,neutral
NYC's Met opera house hosts concert in support of Ukraine,,neutral
"Watkins, Duran & defensive errors - Emery's four tactical dilemmas",,neutral
When Alistair Brownlee helped brother Jonny over finish line,,neutral
CCTV shows Harshita Brella and husband near lake,,neutral
Son of IRA murder victim calls Disney drama 'horrendous',,disgust
Police warn against road travel during Storm Bert,,neutral
'Being stalked was worse than being held at gunpoint',,disgust
Putin says Russia will use new missile again in 'combat conditions',,neutral
Woman wins civil rape case against Conor McGregor,,neutral
Parents 'devastated' over British woman's death in suspected Laos poisoning,,sadness
Two detained over Gatwick Airport 'suspect package',,neutral
"Storm Bert heads to UK with heavy rain, wind and snow",,neutral
King accepts flowers for Queen who misses Royal Variety over illness,,neutral
Farming tax row - BBC Verify on which figures are more reliable and why,,neutral
People smugglers who promoted Tripadvisor-style video reviews convicted,,neutral
Spain fines budget airlines $179m and wants ban on hand luggage charges,,neutral
Trump nominates Scott Bessent to lead US Treasury,,neutral
EasyJet passengers film Iceland volcano lava from above,,neutral
No 10 indicates Netanyahu faces arrest if he enters UK,,neutral
Charged £720 to have a key cut - soaring bills drive leaseholders to breaking point,,neutral
What is methanol and how does it affect the body?,,curiosity
The Papers: 'Business blames budget' and 'UK economy takes hit',,neutral
"The rise of Pam Bondi,  longtime Trump ally who is new  pick for attorney general",,neutral
Everything we know about Russia's Oreshnik missile,,neutral
Will China step up if Trump takes a step back on climate change?,,curiosity
BBC visits mpox clinic as WHO says DR Congo cases 'plateauing',,neutral
"Jailed cancer charity thief ordered to pay back rest of £95,000 she defrauded",,neutral
Allison Pearson says she felt 'bullied' in police probe,,neutral
COP29 overruns as poor countries seethe over climate cash,,neutral
Dutch police find gnome made of MDMA during drug bust,,neutral
Gordon Brown declares opposition to assisted dying,,neutral
Family say Harshita Brella will not be forgotten,,neutral
"Sara Sharif’s dad is in eternal hell, jury told",,neutral
"The Week: Ukraine, Israel and John Prescott reflections",,neutral
'Dreamer' Amorim 'right guy' to revive Man Utd,,neutral
'I will be here' - Guardiola's relegation promise to Man City,,neutral
World champions South Africa lie in wait for Wales ,,neutral
I want England to be brave with the ball - Borthwick,,desire
Vardy best England striker of his generation - Maresca,,neutral
'Chaos for Australia!' Hosts collapse to 67-7 against India,,disappointment
Bomb disposal unit at bus station after 'alert',,neutral
Woman wins civil rape case against Conor McGregor,,neutral
Storm Bert amber snow warning extended in Scotland,,neutral
'Gutted for the girls' as claims grow against football star ,,neutral
"No 'red lines' in Ukraine support, French foreign minister tells BBC",,neutral
Man dies after tree falls on car as Storm Bert sweeps UK,,neutral
'Refused service yet again with my guide dog - I'm done speaking out',,annoyance
Your pictures of Storm Bert from around the UK,,neutral
'Are we not humans?': Anger in Beirut as massive Israeli strike kills 20,,anger
Murray to coach Djokovic at Australian Open,,neutral
"'Trust and reserve judgement' on rebrand, says Jaguar after backlash",,neutral
Mystery drones seen over three US air bases in UK,,neutral
UK wants to hire EU negotiator to 'reset' relations,,neutral
Kayaker's leg amputated in middle of river after 20-hour rescue,,neutral
Israel investigates as Hamas says female hostage killed,,neutral
China's huge sinkholes reveal hidden treasures as viral videos draw tourists,,neutral
The Papers: 'Two thirds back assisted dying' and 'Putin ready to cripple Britain',,neutral
A toxic staffing row is splitting the NHS,,neutral
Free shots and beer buckets in party town at centre of suspected methanol deaths,,neutral
Will Rachel Reeves' difficult week cause her lasting damage?,,curiosity
"Lava, letters and a loch: Photos of the week",,neutral
"I am going to be proud one day, says teen after struggle with mental health system",,pride
Watch: Snowy Saturday as Storm Bert sweeps the UK,,neutral
Murder arrest after man shot dead in Birmingham,,neutral
Flat caps galore at Tommy Shelby lookalike contest,,neutral
Irish justice minister praises 'bravery' of woman in Conor McGregor rape case,,admiration
Kate Nash says her OnlyFans will earn more than her tour,,neutral
John the cat gets stuck in drainpipe,,neutral
The Assisted Dying Debate: Ex-PM Gordon Brown Intervenes,,neutral
'In eight years we never lived like this' - what is wrong at Man City?,,curiosity
Wales coach Gatland to learn fate in coming days,,neutral
Why 'extra special' Nwaneri has to remain patient,,neutral
"'Time for Scotland to deliver result, not moments'",,neutral
Kane scores hat-trick to break Bundesliga record,,neutral
Murray to coach Djokovic at Australian Open,,neutral
Murder arrest after man shot dead in Birmingham,,neutral
Homes flooded and travel disrupted by Storm Bert,,sadness
Flood fears as Storm Bert heads into second day,,neutral
Storm Bert brings landslide and 82mph gusts,,neutral
"Storm Bert floods 'absolutely devastating', says Welsh FM",,neutral
'Don't drink the spirits': Laos backpackers avoid shots after suspected poisonings,,neutral
British man captured while fighting with Ukraine,,neutral
"Young people who refuse to work to lose benefits, says minister",,neutral
"In stifled sobs and fierce accusations, family falls apart at mass rape trial",,sadness
Expelled the same day: Ireland hardens illegal immigration response,,neutral
Adele doesn't know when she'll perform again after tearful Vegas goodbye,,confusion
Huge deal struck but is it enough? 5 takeaways from a dramatic COP29,,curiosity
Irish prime minister apologises for walking away from care worker,,remorse
Wicked opening set to be biggest for Broadway film,,neutral
'I can't say what my face will do in two hours',,neutral
"Feel free to sing in the cinema, says The Rock",,neutral
'Refused service yet again with my guide dog - I'm done speaking out',,annoyance
Your pictures on the theme of 'autumn walks' ,,neutral
'We knew Christmas before you' - the Band Aid fallout ,,neutral
"Martin Lewis meets deepfake scam victim who lost £76,000",,neutral
Burning old TVs to survive: The toxic trade in electrical waste,,neutral
Perfume boss captured on video admitting he ignored Russia sanctions,,neutral
India's 'rebel' Muslim princess who shot tigers and drove a Rolls-Royce,,neutral
Lauren Laverne given 'all clear' following cancer diagnosis,,neutral
"Huge COP29 climate deal too little too late, poorer nations say",,neutral
Dozens killed in Pakistan sectarian violence,,sadness
South Korean man dodged draft by binge eating,,neutral
"Assisted dying bill about right to choose, says minister",,neutral
"Rabbi who went missing in UAE was murdered, Israel says",,neutral
Verstappen wins title as Russell triumphs in Vegas,,neutral
"Will Labour’s Plan For Work, Work?",,neutral
'Now give Mo his dough' - Liverpool can't let Salah leave Anfield,,neutral
'We will suffer for a long period' - why there is no quick fix at Man Utd,,sadness
England are in a very good place - George,,admiration
Why Verstappen's 'almost flawless' season is 'towering achievement',,admiration
Humphries beats Littler to win Players Championship,,neutral
Why Leicester acted quickly to end Cooper reign,,neutral
Scotland 'found a way to win' against Australia,,neutral
Storm Bert causes widespread rail disruption,,neutral
Clean up begins after Storm Bert floods,,neutral
Queensferry Crossing ice closure a 'safety first' decision,,neutral
Anger as Storm Bert leaves trail of destruction,,anger
Two Britons among 16 missing after Red Sea tourist boat sinks,,neutral
More rain forecast after Storm Bert hits UK ,,neutral
Emergency crews tackle flood waters in rescue operations,,neutral
Judge dismisses special counsel's election case against Trump,,neutral
Reeves tells firms no more tax rises as she defends Budget,,neutral
Gangsters block aid distribution in south Gaza,,neutral
Man arrested after eight-year-old girl shot in car,,neutral
"I'm not surprised some voters want election re-run, says Starmer after petition",,neutral
Prosecutors demand 20-year jail sentence for husband in mass rape trial,,neutral
"Israel and Lebanon close to ceasefire deal, Israeli officials say",,neutral
"I had good intentions, says Letby safeguarding boss who failed to raise concerns",,approval
"We were ready to leave climate summit, negotiator tells BBC",,neutral
Barbara Taylor Bradford: An author of substance,,neutral
"The Papers:  'No more tax rises, insists Reeves' and 'PM in jobs push'",,neutral
‘I had no idea being a social drinker would damage my liver by 31’,,confusion
Menendez brothers' resentencing hearing delayed until January,,neutral
How service charges in flats spiralled out of control,,neutral
Elton John album on hold because he 'can't see',,neutral
"People should intervene if they see women at risk of spiking, minister urges",,neutral
Malaysia government told to return seized LGBT watches,,neutral
£1.25 a night Welsh tourism tax may start in 2027,,neutral
Angela Merkel defends ties with Russia and blocking Ukraine from Nato,,neutral
Davina McCall says 'it's nice to be home' after brain surgery,,neutral
Trump's 'border tsar' vows to cut funding to 'sanctuary' states,,neutral
Pakistan police clash with Imran Khan supporters heading to Islamabad,,neutral
"Reeves My Lips, No New Taxes (On Business)",,neutral
Angela Merkel on Putin’s dog and Trump’s handshake,,neutral
Bethell to bat at three on England Test debut,,neutral
Root 'a rung below' Smith and Kohli - Lehmann,,neutral
General Motors agrees deal to enter F1 in 2026,,neutral
'A huge result' - could West Ham win at Newcastle be turning point for Lopetegui?,,curiosity
'As open as it has ever been' - is this the tightest Premier League?,,curiosity
Salah selfish for contract comments - Carragher,,neutral
Man admits murdering 'defenceless' woman in front of friends,,neutral
Parents question 'flawed' Garda canal death probe,,neutral
Supreme Court to hear case on definition of a woman,,neutral
Rugby club devastated by Storm Bert had no insurance,,neutral
What we know about Israel-Hezbollah ceasefire deal,,neutral
"Israel-Hezbollah ceasefire designed to be permanent, says Biden",,neutral
Israeli anger at 'irresponsible and hasty' ceasefire,,anger
Questions over Hezbollah's future after ceasefire,,neutral
"CCTV shows autistic pupils pushed, pinned to walls and sitting in vomit",,neutral
Mother of child hidden in drawer from birth jailed,,neutral
"Vauxhall owner to close Luton factory, putting 1,100 jobs at risk",,neutral
Five survivors found day after Red Sea tourist boat sinking,,neutral
MPs back plans for phased smoking ban,,neutral
'Hardest decision of my career': MPs wrestle with assisted dying choice,,neutral
UK winner of EuroMillions scoops £177m jackpot,,neutral
UK military join hunt for drones near US airbases,,neutral
One of the US's most wanted men arrested in Wales,,neutral
Storm Conall to bring more rain to parts of England and Wales,,neutral
"Harshita Brella's husband was arrested before, says police watchdog",,neutral
Trump proves he is serious on tariffs - but it's not about trade,,neutral
The Papers: Electric car 'chaos' and Israel-Hezbollah ceasefire,,neutral
Watch: How big is the problem of people not working?,,curiosity
"What is Baller League? Why are KSI, Lineker & Terry involved?",,curiosity
Russian deserter reveals war secrets of guarding nuclear base,,neutral
Mum's tribute to 'beautiful' daughter who died on M5,,admiration
Man arrested over tractor drive through floods,,neutral
No 10 denies Russian claims that expelled UK diplomat was a spy,,neutral
Sharp rise in bathing sites rated unfit for swimming,,disappointment
New Mauritius PM has reservations about UK's Chagos deal,,neutral
Black Friday shoppers warned to be wary of deals,,neutral
Climbing inside a Kelpie's head ,,neutral
"Trump, tariffs and trade wars",,neutral
Angela Merkel on Putin’s dog and Trump’s handshake,,neutral
"'Fragile, frail & weak' - Man City's defensive woes continue",,neutral
Zhang makes maximum 147 break at UK Championship,,neutral
'We know what we're doing' - Stokes on Bethell,,neutral
Fans have a right to express how they feel - Guardiola reacts to boos,,neutral
"Rapper Slowthai raped women after gig, court told",,neutral
Remains exhumed from cemetery in Disappeared search,,neutral
Hospitals inquiry families say safety fears remain,,neutral
'I spent my wedding night gambling away our money',,neutral
Police investigate more people over Al Fayed abuse,,neutral
"Jeremy Bowen: The Lebanon ceasefire is a respite, not a solution for the Middle East",,neutral
Bomb threats made against Trump cabinet nominees,,neutral
Lucy Letby's dad 'made threats' in meetings with hospital CEO,,neutral
MPs to debate petition calling for another election,,neutral
Lyse Doucet: Nowhere else on Earth are so many children fleeing war,,neutral
"Liz Hatton, teen photographer who inspired Kate, dies aged 17",,neutral
Israel to appeal against ICC warrants for Netanyahu and Gallant,,neutral
Ex-PM David Cameron backs assisted dying bill ,,neutral
"Mum told partner 'I'm sick of you hitting me' before suicide, manslaughter trial hears",,sadness
Man arrested after secret filming of women shared on TikTok,,neutral
Fans fume over Jason Donovan Rocky Horror no-show,,neutral
Israelis survey damage and mull return to north as ceasefire begins,,neutral
Displaced Lebanese head for homes as fragile truce appears to hold,,neutral
What we know about Israel-Hezbollah deal,,neutral
The conflict in maps: Ceasefire in effect in Lebanon,,neutral
'You can't wipe out Billingsgate Fish Market overnight',,neutral
The Papers:  'Tories failed on migration' and 'cops target Al Fayed network',,neutral
Diver describes rescuing nephew from capsized Egypt boat ,,neutral
Why India's latest Sun mission finding is crucial for the world,,curiosity
'I found out I lost my Vauxhall job on WhatsApp',,sadness
Protest arrests after seven detained over links to Kurdish rebel group PKK,,neutral
Missing hiker found alive after more than five weeks in wilderness,,neutral
Storm Conall brings more rain as it passes over UK,,neutral
Lib Dem leader Ed Davey in bid for Christmas No 1,,neutral
Watch highlights from Mishal Husain's career as she leaves BBC,,neutral
The Israel-Hezbollah Ceasefire,,neutral
Angela Merkel on Putin’s dog and Trump’s handshake,,neutral
'Something special brewing at Slot's remarkable Liverpool',,neutral
Van Nistelrooy set to be appointed Leicester boss,,neutral
England punish sloppy South Africa to seal T20 series,,neutral
Relentless Liverpool beat Real Madrid in thriller,,neutral
"Rapper's friend raped woman at party, court hears",,neutral
Flights cancelled amid yellow weather warning,,neutral
Car speed limits could be cut but raised for HGVs,,neutral
Fears misinformation behind drop in contraception,,fear
Gregg Wallace 'fascinated by my sex life and made lesbian jokes',,neutral
Kirsty Wark: Gregg Wallace used sexualised language and ‘people were uncomfortable’,,neutral
Starmer says migration 'off the scale' after record high last year,,neutral
"Hope, fear, faith and love: Four people on why assisted dying vote matters",,neutral
Transport secretary pleaded guilty to 2014 work phone incident,,neutral
Man who spied for Russia in UK 'discussed killing journalist',,neutral
Ceasefire largely holds but Israelis near Lebanon border have their doubts,,neutral
Families return to destruction in southern Lebanon,,neutral
Daniel Khalife was a British soldier who spied for Iran and dreamed of fame,,neutral
Putin threatens Kyiv decision-makers after striking energy grid,,neutral
All Scottish pensioners to get winter fuel payment,,neutral
"Baby remains were newborn girl, police say",,neutral
Assisted dying bill: What is in proposed law?,,curiosity
'Hardest decision of my career': MPs wrestle with vote choice,,neutral
Last-minute lobbying ahead of major assisted dying vote,,neutral
How assisted dying has spread across the world and how laws differ,,confusion
"Israel building new military dividing line across Gaza, satellite images suggest",,neutral
How the Republic of Ireland will elect its next parliament,,curiosity
'I sold my house to man on FBI's most wanted list',,neutral
Net migration numbers are down - how have the rules changed?,,curiosity
Black Friday: How to spot a deal and not get ripped off,,neutral
"Missed opportunity to stop Lucy Letby, medical boss says",,disappointment
Paris's Gothic jewel Notre-Dame to reopen five years after fire,,neutral
Romania orders election recount after TikTok bias claims,,neutral
Typhoo Tea falls into administration as sales slide,,neutral
Police given misconduct notices over girl's M5 death,,neutral
"Widow, 92, dines at castle each week for 37 years",,neutral
Jay Slater's family stop donations on fundraiser,,neutral
Starmer's Migration Mission,,neutral
The Assisted Dying Debate,,neutral
Amorim enjoys 'special' first Man Utd win despite 'anxiety',,joy
Verstappen 'should start doing comedy' - Norris,,neutral
